THE EPISTLE OF ST. PAUL TO PHILEMON	christ jesus,4;jesus christ,3;lord jesus,3;also do,1;always making,1;aristarchus demas,1;bands onesimus,1;been heretofore,1;been refreshed,1;beseech whereas,1	in christ jesus,3;jesus christ i,2;lord jesus christ,2;the lord jesus,2;a most dear,1;a partner receive,1;a prisoner also,1;account i paul,1;again for ever,1;also a lodging,1	a most dear brother,1;also do more than,1;also of jesus christ,1;also yea brother may,1;always making a remembrance,1;appia our dearest sister,1;archippus our fellow soldier,1;aristarchus demas and luke,1;bands onesimus who hath,1;been heretofore unprofitable to,
THE EPISTLE OF ST. PAUL TO THE HEBREWS	high priest,21;hebrews chapter,12;enter into,9;holy ghost,7;if they,7;jesus christ,7;new testament,7;if we,5;right hand,5;god hath,4	a high priest,7;the holy ghost,7;into the holies,6;order of melchisedech,6;priest for ever,6;son of god,6;the new testament,6;let us go,4;right hand of,4;saith the lord,4	enter into my rest,3;hear his voice harden,3;if they shall enter,3;priest for ever according,3;they shall enter into,3;a little lower than,2;after those days saith,2;camp bearing his reproach,2;days saith the lord,2;good things to come,
THE CATHOLIC EPISTLE OF ST. JAMES THE APOSTLE	james chapter,4;without works,4;dearest brethren,3;faith without,3;god hath,3;poor man,3;whole body,3;brethren if,2;commit adultery,2;divers temptations,2	respect of persons,4;faith without works,3;my dearest brethren,3;works is dead,3;able to save,2;among you let,2;do not they,2;draw nigh to,2;enemy of god,2;fine apparel and,2	faith without works is,2;god hath promised to,2;hath promised to them,2;our lord jesus christ,2;sins one to another,2;which god hath promised,2;without works is dead,2;1 17 for if,1;14 he had ordered,1;17 for if there,
THE FIRST EPISTLE OF ST. PETER THE APOSTLE	jesus christ,9;1 peter,4;doing well,4;peter chapter,4;hath called,3;they may,3;they speak,3;being made,2;christ also,2;christ jesus,2	of jesus christ,6;1 peter chapter,4;a good conscience,2;according to god,2;and ever amen,2;because christ also,2;conscience towards god,2;doing well you,2;empire for ever,2;ever and ever,2	ever and ever amen,2;resurrection of jesus christ,2;that whereas they speak,2;1 peter chapter 2,1;1 peter chapter 3,1;1 peter chapter 4,1;1 peter chapter 5,1;4 exhortations to cease,1;a chief corner stone,1;a constant mutual charity,
THE SECOND EPISTLE OF ST. PETER THE APOSTLE	these things,9;jesus christ,8;saviour jesus,4;lord jesus,3;2 peter,2;dearly beloved,2;holy ghost,2;one day,2;peter chapter,2;private interpretation,2	and saviour jesus,4;lord and saviour,4;saviour jesus christ,4;lord jesus christ,3;of these things,3;our lord jesus,3;2 peter chapter,2;a railing judgment,2;a thousand years,2;bring in sects,2	and saviour jesus christ,4;lord and saviour jesus,3;our lord jesus christ,3;made by private interpretation,2;2 he warns them,1;2 peter chapter 2,1;2 peter chapter 3,1;3 against scoffers denying,1;9 but these men,1;a little while escape,
THE FIRST EPISTLE OF ST. JOHN THE APOSTLE	we know,17;if we,9;little children,8;one another,8;love one,7;unto death,7;god hath,6;jesus christ,6;write unto,6;dearly beloved,5	we know that,14;born of god,9;this we know,9;know that we,8;love one another,7;son of god,7;charity of god,6;i write unto,6;keep his commandments,6;write unto you,6	we know that we,8;we keep his commandments,4;a sin unto death,3;if we say that,3;we say that we,3;and love one another,2;born of god committeth,2;god and life eternal,2;god committeth not sin,2;him if we keep,
THE SECOND EPISTLE OF ST. JOHN THE APOSTLE	god speed,3;lady elect,2;nor say,2;st john,2;ancient bishop,1;antichrist look,1;apostles then,1;bishop st,1;children walking,1;children whom,1	god speed you,3;him god speed,3;nor say to,2;the lady elect,2;a full reward,1;a lady so,1;a new commandment,1;a particular church,1;also all they,1;an antichrist look,1	a lady so eminent,1;ancient bishop st john,1;antichrist look to yourselves,1;apostles then living to,1;are gone out into,1;as teach false doctrine,1;beginning that we love,1;beginning you should walk,1;being the only one,1;bishop st john being,
THE THIRD EPISTLE OF ST. JOHN THE APOSTLE	jesus christ,8;dearly beloved,7;lord jesus,4;st jude,3;write unto,3;being judged,2;blaspheme majesty,2;building yourselves,2;contend earnestly,2;contended about,2	lord jesus christ,4;our lord jesus,4;to write unto,3;about the body,2;beloved be mindful,2;beware of heretics,2;building yourselves upon,2;christ our lord,2;contend earnestly for,2;contended about the,2	our lord jesus christ,4;beware of heretics jude,2;building yourselves upon your,2;contended about the body,2;dearly beloved be mindful,2;faith first delivered to,2;first delivered to them,2;indeed reprove being judged,2;jesus christ our lord,2;last time there should,
THE APOCALYPSE OF ST. JOHN THE APOSTLE	apocalypse chapter,21;these things,21;third part,15;living creatures,14;loud voice,13;twelve thousand,13;four living,12;thousand signed,12;they should,11;seven angels,10	upon the earth,16;third part of,15;ever and ever,14;the third part,14;a loud voice,13;four living creatures,12;twelve thousand signed,12;the four living,11;thousand signed of,11;that they should,9	the four living creatures,11;twelve thousand signed of,11;ear let him hear,8;angel sounded the trumpet,7;hath an ear let,7;out his vial upon,7;poured out his vial,7;write these things saith,7;four and twenty ancients,6;after these things i,
