Book	Chapter	Verse	Text	Index	Version
Colossians	1	1	From Paul, an apostle of Christ Jesus, by the will of God, and from Timothy, also a follower of the Lord.	1	OEB
Colossians	1	2	To Christ’s people at Colossae – the followers who are faithful to him: May God, our Father, bless you and give you peace.	1	OEB
Colossians	1	3	Whenever we pray we never fail to thank God, the Father of our Lord Jesus Christ, for you,	1	OEB
Colossians	1	4	now that we have heard of your faith in Christ Jesus and of the love that you have for all his people,	1	OEB
Colossians	1	5	because of the hope which is kept safe for you in heaven. Of this hope you heard long ago in the true message of the good news which reached you,	1	OEB
Colossians	1	6	bearing fruit and growing, as it does, through all the world, just as it did among you from the very day that you heard of God’s loving kindness, and understood what that loving kindness really is.	1	OEB
Colossians	1	7	It is just what you learned from Epaphras, our dear fellow servant, who, as a minister of the Christ, faithfully represents us,	1	OEB
Colossians	1	8	and who told us of the love with which the Spirit has inspired you.	1	OEB
Colossians	1	9	And therefore we, from the very day that we heard this, have never ceased praying for you, or asking that you may be filled with the knowledge of the will of God, which comes through all true spiritual wisdom and insight.	1	OEB
Colossians	1	10	Then you will live lives worthy of the Master, and so please God in every way. Your lives will be fruitful in every kind of good action, and grow into a fuller knowledge of God;	1	OEB
Colossians	1	11	you will be made strong at all points with a strength worthy of the power manifested in his glory – strong to endure with patience, and even with gladness, whatever may happen to you;	1	OEB
Colossians	1	12	and you will give thanks to the Father who made you fit to share the lot which awaits Christ’s people in the realms of light.	1	OEB
Colossians	1	13	For God has rescued us from the tyranny of darkness, and has removed us into the kingdom of his Son, who is the embodiment of his love,	1	OEB
Colossians	1	14	and through whom we have found deliverance in the forgiveness of our sins.	1	OEB
Colossians	1	15	For Christ is the incarnation of the invisible God – firstborn and head of all creation;	1	OEB
Colossians	1	16	for in him was created all that is in heaven and on earth, the visible and the invisible – angels and archangels and all the powers of heaven.	1	OEB
Colossians	1	17	All has been created through him and for him. He was before all things, and all things unite in him;	1	OEB
Colossians	1	18	and he is the head of the church, which is his body. The firstborn from the dead, he is to the church the source of its life, that he, in all things, may stand first.	1	OEB
Colossians	1	19	For it pleased the Father that in him the divine nature in all its fulness should live,	1	OEB
Colossians	1	20	and through him to reconcile all things to himself (making peace by the shedding of Christ’s blood offered on the cross) – whether on earth or in heaven.	1	OEB
Colossians	1	21	And it pleased God that you, once estranged from him and hostile towards him in your thoughts, intent only on wickedness –	1	OEB
Colossians	1	22	but now he has reconciled you to himself by the sacrifice of Christ’s earthly body in death – it has pleased God that you should stand in his presence holy, pure, and blameless,	1	OEB
Colossians	1	23	if only you remain true to your faith, firm and immovable, never abandoning the hope held out in the good news to which you listened, which has been proclaimed among all created things under heaven, and of which I, Paul, was made an assistant.	1	OEB
Colossians	1	24	Now at last I can rejoice in my sufferings on your behalf, and in my own person I supplement the afflictions endured by the Christ, for the sake of his body, the church;	1	OEB
Colossians	1	25	of which I myself became a minister in virtue of the office with which God entrusted me for your benefit, to declare the message of God in all its fulness –	1	OEB
Colossians	1	26	that truth which has been hidden from former ages and generations. But now it has been revealed to God’s people,	1	OEB
Colossians	1	27	to whom it was his pleasure to make known the surpassing glory of that hidden truth when proclaimed among the Gentiles – ‘Christ among you! Your hope of glory!’	1	OEB
Colossians	1	28	This is the Christ whom we proclaim, warning everyone, and instructing everyone, with all the wisdom that we possess, in the hope of bringing everyone into God’s presence perfected by union with Christ.	1	OEB
Colossians	1	29	It is for that I toil, struggling with all the energy which he inspires and which works powerfully within me.	1	OEB
Colossians	2	1	I want you to know in how great a struggle I am engaged for you and for Christ’s people at Laodicea, and for all who have not yet seen me;	1	OEB
Colossians	2	2	in the hope that they, being bound to one another by love, and keeping in view the full blessedness of a firm conviction, may be encouraged to strive for a perfect knowledge of God’s hidden truth,	1	OEB
Colossians	2	3	even Christ himself, in whom all treasures of wisdom and knowledge lie hidden.	1	OEB
Colossians	2	4	I say this to prevent anyone from deceiving you by plausible arguments.	1	OEB
Colossians	2	5	It is true that I am not with you in person, but I am with you in spirit, and am glad to see the good order and the unbroken front resulting from your faith in Christ.	1	OEB
Colossians	2	6	Since, therefore, you have received Jesus, the Christ, as your Lord, live your lives in union with him –	1	OEB
Colossians	2	7	rooted in him, building up your characters through union with him, growing stronger through your faith, as you were taught, overflowing with faith and thanksgiving.	1	OEB
Colossians	2	8	Take care that there is not someone who will carry you away by his ‘philosophy’ – a hollow sham! – following, as it does, mere human traditions, and dealing with puerile questions of this world, and not with Christ.	1	OEB
Colossians	2	9	For in Christ the Godhead in all its fulness dwells incarnate;	1	OEB
Colossians	2	10	and, by your union with him, you also are filled with it. He is the head of all archangels and powers of heaven.	1	OEB
Colossians	2	11	By your union with him you received a circumcision that was not performed by human hands, when you threw off the tyranny of the earthly body, and received the circumcision of the Christ.	1	OEB
Colossians	2	12	For in baptism you were buried with Christ; and in baptism you were also raised to life with him, through your faith in the omnipotence of God, who raised him from the dead.	1	OEB
Colossians	2	13	And to you, who once were dead, by reason of your sins and your uncircumcised nature – to you God gave life in giving life to Christ! He pardoned all our sins!	1	OEB
Colossians	2	14	He canceled the bond which stood against us – the bond that consisted of ordinances – and which was directly hostile to us! He has taken it out of our way by nailing it to the cross!	1	OEB
Colossians	2	15	He rid himself of all the powers of evil, and held them up to open contempt, when he celebrated his triumph over them on the cross!	1	OEB
Colossians	2	16	Do not, then, allow anyone to take you to task on questions of eating or drinking, or in the matter of annual or monthly or weekly festivals.	1	OEB
Colossians	2	17	These things are only the shadow of what is to come; the substance is in the Christ.	1	OEB
Colossians	2	18	Do not let anyone defraud you of the reality by affecting delight in so-called ‘humility’ and angel-worship. Such a person busies themselves with their visions, and without reason are rendered conceited by their merely human intellect.	1	OEB
Colossians	2	19	They fail to maintain union with the head, to whom it is due that the whole body, nourished and knit together by the contact and connexion of every part, grows with a divine growth.	1	OEB
Colossians	2	20	Since, with Christ, you became dead to the puerile teaching of this world, why do you submit, as if you still belonged to the world,	1	OEB
Colossians	2	21	to such ordinances as ‘Do not handle, or taste, or touch’?	1	OEB
Colossians	2	22	For all the things referred to in them cease to exist when used. You are following mere human directions and instructions.	1	OEB
Colossians	2	23	Such prohibitions appear reasonable where there is a desire for self-imposed service, and so-called ‘humility,’ and harsh treatment of the body, but are of no real value against the indulgence of our earthly nature.	1	OEB
Colossians	3	1	Since, therefore, you were raised to life with the Christ, seek for the things that are above; for it is there that the Christ is seated at the right hand of God.	1	OEB
Colossians	3	2	Fix your thoughts on the things that are above, not on those that are on earth.	1	OEB
Colossians	3	3	For you died, and your life now lies hidden, with the Christ, in God.	1	OEB
Colossians	3	4	When the Christ, who is our life, appears, then you also will appear with him in glory.	1	OEB
Colossians	3	5	Therefore destroy all that is earthly in you – immorality, uncleanness, passions, evil desires, and that greed which is idolatry.	1	OEB
Colossians	3	6	These are the things because of which the wrath of God comes,	1	OEB
Colossians	3	7	and to which you, like others, once devoted your lives, when you lived for them.	1	OEB
Colossians	3	8	You, however, must now lay aside all such things – anger, passion, malice, slander, abuse.	1	OEB
Colossians	3	9	Never lie to one another. Get rid of your old self and its habits,	1	OEB
Colossians	3	10	and clothe yourselves with that new self, which, as it gains in knowledge, is being constantly renewed in resemblance to him who made it.	1	OEB
Colossians	3	11	In that new life there is no distinction between Greek and Jew, circumcised and uncircumcised, barbarian, Scythian, slave, free; but Christ is all! – and in all!	1	OEB
Colossians	3	12	Therefore, as God’s people, consecrated and dear to him, clothe yourselves with tenderness of heart, kindliness, humility, gentleness, forbearance;	1	OEB
Colossians	3	13	bearing with one another, and, when there is any ground for complaint, forgiving one another freely. As the Master freely forgave you, so you must forgive one another.	1	OEB
Colossians	3	14	Over all these virtues put on love; for that is the belt which makes all complete.	1	OEB
Colossians	3	15	Let the peace that the Christ gives decide all doubts within your hearts; for you also were called to the enjoyment of peace as members of one body. And show yourselves thankful.	1	OEB
Colossians	3	16	Let the message of the Christ be alive in your minds in all its wealth, bringing all wisdom with it. Teach and admonish one another with psalms, and hymns, and sacred songs, full of the loving kindness of God, lifting your hearts in song to him.	1	OEB
Colossians	3	17	And, whatever you say or do, do everything in the name of the Lord Jesus; and through him offer thanksgiving to God the father.	1	OEB
Colossians	3	18	Wives, submit to your husbands, as befits those who belong to the Lord.	1	OEB
Colossians	3	19	Husbands, love your wives, and never treat them harshly.	1	OEB
Colossians	3	20	Children, always obey your parents; for that is pleasant to see in those who belong to the Lord.	1	OEB
Colossians	3	21	Fathers, never irritate your children, otherwise they might become disheartened.	1	OEB
Colossians	3	22	Slaves, always obey your earthly masters, not only when their eyes are on you, as if you had but to please people alone, but giving them ungrudging service, in your respect for the Master.	1	OEB
Colossians	3	23	Whatever you do, do it with all your heart, as if working for the Master and not for people,	1	OEB
Colossians	3	24	since you know that it is from the Master that you will receive the inheritance which will be your reward. You are serving Christ, the Master.	1	OEB
Colossians	3	25	Those who do wrong will reap the wrong they have done; and there will be no partiality.	1	OEB
Colossians	4	1	Masters, do what is right and fair by your slaves, for you know that you also have a Master – in heaven.	1	OEB
Colossians	4	2	Devote yourselves to prayer. Give your whole mind to it, and also offer thanksgiving;	1	OEB
Colossians	4	3	and at the same time pray for us, so that God may give us an opening for our message, so that we may speak of the truths hidden in the Christ – the truths for which I am in chains!	1	OEB
Colossians	4	4	Then I will make them known, as I ought to do.	1	OEB
Colossians	4	5	Show tact in your behavior to the outside world, making the most of every opportunity.	1	OEB
Colossians	4	6	Let your conversation always be kindly, but not bland, season it, as it were, with salt; be aware in each case of the answer you should be giving.	1	OEB
Colossians	4	7	Our dear friend, Tychicus, will tell you all about me. He is a faithful minister, and a fellow servant in the Master’s cause.	1	OEB
Colossians	4	8	I send him to you expressly that you may learn our circumstances, and that he may give you encouragement.	1	OEB
Colossians	4	9	With him will be Onesimus, our dear faithful friend, who is one of yourselves. They will tell you all that is going on here.	1	OEB
Colossians	4	10	My fellow prisoner, Aristarchus, sends you his greeting, and Barnabas’s cousin, Mark, sends his. (You have received directions about him. If he comes to you, make him welcome.)	1	OEB
Colossians	4	11	Joshua, who is called Justus, also sends his greeting. These are the only converts from Judaism who have worked with me for the kingdom of God; I have found them a great comfort.	1	OEB
Colossians	4	12	Epaphras, who is one of yourselves, sends you his greeting. He is a servant of Christ Jesus, and is always most earnest in your behalf in his prayers, praying that you may stand firm, with a matured faith and with a sure conviction of all that is in accordance with God’s will.	1	OEB
Colossians	4	13	I can bear testimony to the deep interest he takes in you, as well as in the followers at Laodicea and at Hierapolis.	1	OEB
Colossians	4	14	Luke, our dear doctor, sends you his greeting, and Demas sends his.	1	OEB
Colossians	4	15	Give my greeting to the followers at Laodicea, and to Nymphe, and to the church that meets at her house.	1	OEB
Colossians	4	16	And when this letter has been read to you, see that it is also read before the church at Laodicea, and that you yourselves read the letter which will be forwarded from there.	1	OEB
Colossians	4	17	Give this message to Archippus – ‘Take care to discharge to the best of your ability the office to which you were appointed in the Master’s cause.’	1	OEB
Colossians	4	18	I, Paul, add this greeting in my own handwriting. Remember these chains of mine. God’s blessing be with you.	1	OEB
Ephesians	1	1	To Christ’s people at Ephesus who are faithful to him, from Paul, an apostle of Christ Jesus, by the will of God.	2	OEB
Ephesians	1	2	May God, our Father, and the Lord Jesus Christ bless you and give you peace.	2	OEB
Ephesians	1	3	Blessed is the God and Father of Jesus Christ, our Lord, who has blessed us on high with every spiritual blessing, in Christ.	2	OEB
Ephesians	1	4	For he chose us in our union with Christ before the creation of the universe, so that we might be holy and blameless in his sight, living in the spirit of love.	2	OEB
Ephesians	1	5	From the first he destined us, in his goodwill towards us, to be adopted as sons through Jesus Christ,	2	OEB
Ephesians	1	6	and so to enhance that glorious manifestation of his loving kindness which he gave us in the one he loves;	2	OEB
Ephesians	1	7	for in him, and through the shedding of his blood, we have found redemption in the pardon of our offenses.	2	OEB
Ephesians	1	8	All this accords with the loving kindness which God lavished on us, accompanied by countless gifts of wisdom and discernment,	2	OEB
Ephesians	1	9	when he made known to us his hidden purpose. And it also accords with the goodwill which God purposed to exhibit in Christ,	2	OEB
Ephesians	1	10	in view of that divine order which was to mark the completion of the ages, when he should make everything, both in heaven and on earth, center in him.	2	OEB
Ephesians	1	11	In him, I say, for by our union with him we became God’s heritage, having from the first been destined for this in the intention of him who, in all that happens, is carrying out his own fixed purpose;	2	OEB
Ephesians	1	12	that we should enhance his glory – we who have been the first to rest our hopes on the Christ.	2	OEB
Ephesians	1	13	And you, too, by your union with him, after you had heard the message of the truth, the good news of your salvation – you believed in him and were sealed as his by receiving the holy Spirit, which he had promised.	2	OEB
Ephesians	1	14	And the Spirit is a pledge of our future heritage, foreshadowing the full redemption of God’s own people – to enhance his glory.	2	OEB
Ephesians	1	15	And therefore I, ever since I heard of the faith in the Lord Jesus which prevails among you, and of your confidence in all Christ’s people,	2	OEB
Ephesians	1	16	have never omitted to thank God on your behalf, whenever I make mention of you in my prayers.	2	OEB
Ephesians	1	17	My prayer is that the God of Jesus Christ our Lord, the all-glorious Father, may inspire you with wisdom and true insight through a fuller knowledge of himself;	2	OEB
Ephesians	1	18	that your minds may be so enlightened that you may realize the hope given by God’s call, the wealth of the glory of his heritage among Christ’s people,	2	OEB
Ephesians	1	19	and the transcendent greatness of the power which he is able to exercise in dealing with us who believe in him.	2	OEB
Ephesians	1	20	The same mighty power was exerted on the Christ, when he raised the Christ from the dead and ‘caused him to sit at his right hand’ on high, exalting him above all angels and archangels of every rank,	2	OEB
Ephesians	1	21	and above every name that can be named, whether in the present age, or in the age to come.	2	OEB
Ephesians	1	22	And God placed all things under Christ’s feet, and gave him to the church as its supreme head;	2	OEB
Ephesians	1	23	for the church is Christ’s body, and is filled by him who fills all things everywhere with his presence.	2	OEB
Ephesians	2	1	You yourselves were once dead because of your offenses and sins.	2	OEB
Ephesians	2	2	For at one time you lived in sin, following the ways of the world, in subjection to the Ruler of the powers of the air – the Spirit who is still at work among the disobedient.	2	OEB
Ephesians	2	3	And it was among them that we all once lived our lives, indulging the cravings of our earthly nature, and carrying out the desires prompted by that earthly nature and by our own thoughts. Our nature exposed us to the divine wrath, like the rest of humanity.	2	OEB
Ephesians	2	4	Yet God, in his abundant compassion, and because of the great love with which he loved us,	2	OEB
Ephesians	2	5	even though we were dead because of our offenses, gave life to us in giving life to the Christ. (By God’s loving kindness you have been saved.)	2	OEB
Ephesians	2	6	And, through our union with Christ Jesus, God raised us with him, and caused us to sit with him on high,	2	OEB
Ephesians	2	7	in order that, by his goodness to us in Christ Jesus, he might display in the ages to come the boundless wealth of his loving kindness.	2	OEB
Ephesians	2	8	For it is by God’s loving kindness that you have been saved, through your faith. It is not due to yourselves; the gift is God’s.	2	OEB
Ephesians	2	9	It is not due to obedience to Law, so that no one can boast.	2	OEB
Ephesians	2	10	For we are God’s handiwork, created, by our union with Christ Jesus, for the good actions in doing which God had pre-arranged that we should spend our lives.	2	OEB
Ephesians	2	11	Remember, therefore, that you were once Gentiles yourselves, as your bodies showed; you were called ‘the Uncircumcised’ by those who were called ‘the Circumcised’ – circumcised only by human hands!	2	OEB
Ephesians	2	12	Remember that you were at that time far from Christ; you were shut out from the citizenship of Israel; you were strangers to the covenants founded on God’s promise; you were in the world without hope and without God.	2	OEB
Ephesians	2	13	But now, through your union with Christ Jesus, you who once were far off have, by the shedding of the blood of the Christ, been brought near.	2	OEB
Ephesians	2	14	He it is who is our peace. He made the two divisions of humanity one, broke down the barrier that separated them,	2	OEB
Ephesians	2	15	and in his human nature put an end to the cause of enmity between them – the Law with its injunctions and ordinances – in order to create, through union with himself, from Jew and Gentile, one new humanity and so make peace.	2	OEB
Ephesians	2	16	And when, on the cross, he had destroyed their mutual enmity, he sought by means of his cross to reconcile them both to God, united in one body.	2	OEB
Ephesians	2	17	He came with the good news of peace for you who were far off, and of peace for those who were near;	2	OEB
Ephesians	2	18	for it is through him that we, the Jews and the Gentiles, united in the one Spirit, are now able to approach the Father.	2	OEB
Ephesians	2	19	It follows, then, that you are no longer strangers and foreigners, but are fellow citizens with Christ’s people and members of God’s household.	2	OEB
Ephesians	2	20	You have been built up on the foundation laid by the apostles and prophets, Christ Jesus himself being the cornerstone.	2	OEB
Ephesians	2	21	United in him, every part of the building, closely joined together, will grow into a temple, consecrated by its union with the Lord.	2	OEB
Ephesians	2	22	And, through union in him, you also are being built up together, to be a place where God lives through the Spirit.	2	OEB
Ephesians	3	1	For this reason I, Paul, the prisoner of Jesus, the Christ, for the sake of you Gentiles –	2	OEB
Ephesians	3	2	For you have heard, I suppose, of the responsible charge with which God entrusted me for your benefit,	2	OEB
Ephesians	3	3	and also that it was by direct revelation that the hidden purpose of God was made known to me, as I have already briefly told you.	2	OEB
Ephesians	3	4	And, by reading what I have written, you will be able to judge how far I understand this hidden purpose of God in Christ.	2	OEB
Ephesians	3	5	In former generations it was not made known to humanity, as fully as it has now been revealed by the Spirit to the apostles and prophets among Christ’s people –	2	OEB
Ephesians	3	6	That, by union with Christ Jesus and through the good news, the Gentiles are coheirs with us and members of one body, and that they share with us in God’s Promise.	2	OEB
Ephesians	3	7	Of this good news I become an assistant, in virtue of the charge with which God entrusted me in the exercise of his power –	2	OEB
Ephesians	3	8	Yes, to me, who am less than the least of all Christ’s people, was this charge entrusted! – to tell the Gentiles the good news of the boundless wealth to be found in the Christ,	2	OEB
Ephesians	3	9	and to make clear what is God’s way of working out that hidden purpose which from the first has been concealed in the mind of the Creator of all things;	2	OEB
Ephesians	3	10	so that now to the archangels and to all the powers on high should be made known, through the church, the all-embracing wisdom of God,	2	OEB
Ephesians	3	11	in accordance with that purpose which runs through all the ages and which he has now accomplished in Jesus, the Christ, our Master.	2	OEB
Ephesians	3	12	And in union with him, and through our trust in him, we find courage to approach God with confidence.	2	OEB
Ephesians	3	13	Therefore I beg you not to be disheartened at the sufferings that I am undergoing for your sakes; for they redound to your honor.	2	OEB
Ephesians	3	14	For this reason, then, I kneel before the Father –	2	OEB
Ephesians	3	15	from whom all ‘fatherhood’ in heaven and on earth derives its name –	2	OEB
Ephesians	3	16	and pray that, in proportion to the wealth of his glory, he will strengthen you with his power by breathing his Spirit into your inmost soul,	2	OEB
Ephesians	3	17	so that the Christ, through your faith, may make his home within your hearts in love; and I pray that you, now firmly rooted and established, may, with all Christ’s people,	2	OEB
Ephesians	3	18	have the power to comprehend in all its width and length and height and depth,	2	OEB
Ephesians	3	19	and to understand – though it surpasses all understanding – the love of the Christ; and so be filled with all the fullness of God.	2	OEB
Ephesians	3	20	To him who, through his power which is at work within us, is able to do far more than anything that we can ask or conceive –	2	OEB
Ephesians	3	21	to him be all glory through the church and through Christ Jesus, for all generations, age after age. Amen.	2	OEB
Ephesians	4	1	I beg you, then – I who am a prisoner in the Master’s cause – to live lives worthy of the call that you have received;	2	OEB
Ephesians	4	2	always humble and gentle, patient, bearing lovingly with one another,	2	OEB
Ephesians	4	3	and striving to maintain in the bond of peace the unity given by the Spirit.	2	OEB
Ephesians	4	4	There is but one body and one Spirit, just as there was but one hope set before you when you received your call.	2	OEB
Ephesians	4	5	There is but one Lord, one faith, one baptism.	2	OEB
Ephesians	4	6	There is but one God and Father of all – the God who is over all, pervades all, and is in all.	2	OEB
Ephesians	4	7	Everyone of us, however, has been entrusted with some charge, each in accordance with the extent of the gift of the Christ.	2	OEB
Ephesians	4	8	That is why it is said –	2	OEB
Ephesians	4	9	Now surely this ‘going up’ must imply that he had already gone down into the world beneath.	2	OEB
