Book	Chapter	Verse	Text	Index	Version
Galatians	4	16	Am I to think, then, that I have become your enemy by telling you the truth?	9	OEB
Galatians	4	17	Certain people are seeking your favor, but with no honorable object. No, indeed, they want to isolate you, so that you will have to seek their favor.	9	OEB
Galatians	4	18	It is always honorable to have your favor sought in an honorable cause, and not only when I am with you, my dear children –	9	OEB
Galatians	4	19	you for whom I am again enduring a mother’s pains, until a likeness to Christ will have been formed in you.	9	OEB
Galatians	4	20	But I could wish to be with you now and speak in a different tone, for I am perplexed about you.	9	OEB
Galatians	4	21	Tell me, you who want to be still subject to Law – Why don’t you listen to the Law?	9	OEB
Galatians	4	22	Scripture says that Abraham had two sons, one the child of the slave-woman and the other the child of the free woman.	9	OEB
Galatians	4	23	But the child of the slave-woman was born in the course of nature, while the child of the free woman was born in fulfillment of a promise.	9	OEB
Galatians	4	24	This story may be taken as an allegory. The women stand for two covenants. One covenant, given from Mount Sinai, produces a race of slaves and is represented by Hagar.	9	OEB
Galatians	4	25	Hagar stands for Mount Sinai in Arabia, and represents the Jerusalem of today, for she and her children are in slavery.	9	OEB
Galatians	4	26	But the Jerusalem above is free, and she it is who is our mother.	9	OEB
Galatians	4	27	For scripture says –	9	OEB
Galatians	4	28	As for ourselves, friends, we, like Isaac, are children born in fulfillment of a promise.	9	OEB
Galatians	4	29	Yet at that time the child born in the course of nature persecuted the child born by the power of the Spirit; and it is the same now.	9	OEB
Galatians	4	30	But what does the passage of scripture say?	9	OEB
Galatians	4	31	And so, friends, we are not children of a slave, but of her who is free.	9	OEB
Galatians	5	1	It is for freedom that Christ set us free; stand firm therefore, and do not again be held under the yoke of slavery.	9	OEB
Galatians	5	2	Understand that I, Paul, myself tell you that if you allow yourselves to be circumcised, Christ will avail you nothing.	9	OEB
Galatians	5	3	I again declare to everyone who receives circumcision, that he binds himself to obey the whole Law.	9	OEB
Galatians	5	4	You have severed yourselves from Christ – you who are seeking to be pronounced righteous through Law; you have fallen away from love.	9	OEB
Galatians	5	5	For we, by the help of the Spirit, are eagerly waiting for the fulfillment of our hope – that we may be pronounced righteous as the result of faith.	9	OEB
Galatians	5	6	If we are in union with Christ Jesus, neither is circumcision nor the omission of it anything, but faith, working through love, is everything.	9	OEB
Galatians	5	7	You were once making good progress! Who has hindered you from obeying the truth?	9	OEB
Galatians	5	8	The persuasion brought to bear on you does not come from him who calls you.	9	OEB
Galatians	5	9	A little yeast leavens all the dough.	9	OEB
Galatians	5	10	I, through my union with the Lord, am persuaded that you will learn to think with me. But the man who is disturbing your minds will have to bear his punishment, whoever he may be.	9	OEB
Galatians	5	11	If I, friends, am still proclaiming circumcision, why am I still persecuted? It seems that the cross has ceased to be an obstacle!	9	OEB
Galatians	5	12	I could even wish that the people who are unsettling you would go further still and mutilate themselves.	9	OEB
Galatians	5	13	Remember, friends, to you the call came to give you freedom. Only, do not make your freedom an opportunity for self-indulgence but serve one another in a loving spirit.	9	OEB
Galatians	5	14	Indeed, the whole Law has been summed up in this one precept –	9	OEB
Galatians	5	15	But, if you are continually wounding and preying on one another, take care that you are not destroyed by one another.	9	OEB
Galatians	5	16	This is what I have to say – Let your steps be guided by the Spirit, and then you will never gratify the cravings of your earthly nature.	9	OEB
Galatians	5	17	For these cravings of our earthly nature conflict with the Spirit, and the Spirit with our earthly nature – they are two contrary principles – so that you cannot do what you wish.	9	OEB
Galatians	5	18	But, if you follow the guidance of the Spirit, you are not subject to Law.	9	OEB
Galatians	5	19	The sins of our earthly nature are unmistakable. They are sins like these – sexual immorality, impurity, indecency,	9	OEB
Galatians	5	20	idolatry, sorcery, quarrels, strife, jealousy, outbursts of passion, rivalries, dissensions, divisions,	9	OEB
Galatians	5	21	feelings of envy, drunkenness, revelry, and the like. And I warn you, as I warned you before, that those who indulge in such things will have no place in the kingdom of God.	9	OEB
Galatians	5	22	But the fruit produced by the Spirit is love, joy, peace, forbearance, kindliness, generosity, trustfulness, gentleness, self-control.	9	OEB
Galatians	5	23	Against such things there is no law!	9	OEB
Galatians	5	24	And those who belong to Jesus, the Christ, have already crucified their earthly nature, with its passions and its cravings.	9	OEB
Galatians	5	25	Since our life is due to the Spirit, let us rule our conduct also by the Spirit.	9	OEB
Galatians	5	26	Do not let us grow vain, and provoke or envy one another.	9	OEB
Galatians	6	1	My friends, even if someone should be caught committing a sin, you who are spiritually minded should, in a gentle spirit, help them to recover themselves, taking care that you yourselves are not tempted.	9	OEB
Galatians	6	2	Bear one another’s burdens, and so carry out the Law of the Christ.	9	OEB
Galatians	6	3	If a person imagines themselves to be somebody, when they are really nobody, they deceive themselves.	9	OEB
Galatians	6	4	Let everyone test their own work, and then their cause for satisfaction will be in themselves and not in a comparison with their neighbor;	9	OEB
Galatians	6	5	for everyone must bear their own load.	9	OEB
Galatians	6	6	The person, however, who is being instructed in the message ought always to share their blessings with their teacher.	9	OEB
Galatians	6	7	Do not be deceived. God cannot be mocked. What a person sows that they will reap.	9	OEB
Galatians	6	8	For the person who sows the field of their earthly nature will from that earthly nature reap corruption; while the one who sows the field of the spirit will from that spirit reap eternal life.	9	OEB
Galatians	6	9	Let us never tire of doing right, for at the proper season we will reap our harvest, if we do not grow weary.	9	OEB
Galatians	6	10	Therefore, I say, as the opportunity occurs, let us treat everyone with kindness, and especially members of the household of the faith.	9	OEB
Galatians	6	11	See in what large letters I am writing with my own hand.	9	OEB
Galatians	6	12	The people who are trying to compel you to be circumcised are the people who wish to appear to advantage in regard to outward observances. They do it only to avoid being persecuted for the cross of Jesus, the Christ	9	OEB
Galatians	6	13	Even these men who are circumcised do not themselves keep the Law; yet they want you to be circumcised, so that they may boast of your observance of the rite.	9	OEB
Galatians	6	14	But, for my part, may I never boast of anything except the cross of Jesus Christ, our Master, through whom the world has been crucified to me, and I to the world.	9	OEB
Galatians	6	15	For neither is circumcision nor the omission of it anything; but a new nature is everything.	9	OEB
Galatians	6	16	May all who rule their conduct by this principle find peace and mercy – they who are the Israel of God.	9	OEB
Galatians	6	17	For the future let no one trouble me; for I bear the marks of Jesus branded on my body.	9	OEB
Galatians	6	18	May the blessing of Jesus Christ, our Lord, rest on your souls, friends. Amen.	9	OEB
Hebrews	1	1	God, who, of old, at many times and in many ways, spoke to our ancestors, by the prophets,	10	OEB
Hebrews	1	2	has in these latter days spoken to us by the Son, whom he appointed the heir of all things, and through whom he made the universe.	10	OEB
Hebrews	1	3	For he is the radiance of the glory of God and the expression of his being, upholding all creation by the power of his word; and, when he had made an expiation for the sins of humanity, he took his seat at the right hand of God’s Majesty on high,	10	OEB
Hebrews	1	4	having shown himself as much greater than the angels as the name that he has inherited surpasses theirs.	10	OEB
Hebrews	1	5	For to which of the angels did God ever say –	10	OEB
Hebrews	1	6	And again, when God brought the firstborn into the world, he said –	10	OEB
Hebrews	1	7	Speaking of the angels, he said –	10	OEB
Hebrews	1	8	while of the Son he said –	10	OEB
Hebrews	1	9	You love righteousness and hates iniquity;	10	OEB
Hebrews	1	10	Again –	10	OEB
Hebrews	1	11	They will perish, but you remain;	10	OEB
Hebrews	1	12	As a mantle you will fold them up,	10	OEB
Hebrews	1	13	To which of the angels has God ever said –	10	OEB
Hebrews	1	14	Are not all the angels spirits in the service of God, sent out to minister for the sake of those who are destined to obtain salvation?	10	OEB
Hebrews	2	1	Therefore we must give still more heed to what we were taught, so we do not drift away.	10	OEB
Hebrews	2	2	For, if the message which was delivered by angels had its authority confirmed, so that every offense against it, or neglect of it, met with a fitting requital,	10	OEB
Hebrews	2	3	how can we, of all people, expect to escape, if we disregard so great a salvation? It was the Master who at the outset spoke of this salvation, and its authority was confirmed for us by those who heard him,	10	OEB
Hebrews	2	4	while God himself added his testimony to it by signs, and marvels, and many different miracles, as well as by imparting the Holy Spirit as he saw fit.	10	OEB
Hebrews	2	5	God has not given to angels the control of that future world of which we are speaking!	10	OEB
Hebrews	2	6	No; a writer has declared somewhere –	10	OEB
Hebrews	2	7	You have made them, for a while, lower than angels;	10	OEB
Hebrews	2	8	you have placed all things beneath their feet.’	10	OEB
Hebrews	2	9	What our eyes do see is Jesus, who was made for a while lower than angels, now, because of his sufferings and death, crowned with glory and honor; so that his tasting the bitterness of death should, in God’s loving kindness, be on behalf of all humanity.	10	OEB
Hebrews	2	10	It was, indeed, fitting that God, for whom and through whom all things exist, should, when leading many children to glory, make the author of their salvation perfect through suffering.	10	OEB
Hebrews	2	11	For he who purifies, and those whom he purifies, all spring from One; and therefore he is not ashamed to call them his brothers and sisters.	10	OEB
Hebrews	2	12	He says –	10	OEB
Hebrews	2	13	And again –	10	OEB
Hebrews	2	14	Therefore, since human nature is the common heritage of the children, Jesus also shared it, in order that by death he might render powerless him whose power lies in death – that is, the devil –	10	OEB
Hebrews	2	15	and so might deliver all those who, from fear of death, had all their lives been living in slavery.	10	OEB
Hebrews	2	16	It was not, surely, to the help of the angels that Jesus came, but to the help of the descendants of Abraham.	10	OEB
Hebrews	2	17	And consequently it was necessary that he should in all points be made like his brothers and sisters, in order that he might prove a merciful as well as a faithful high priest in humanity’s relations with God, for the purpose of expiating the sins of his people.	10	OEB
Hebrews	2	18	The fact that he himself suffered under temptation enables him to help those who are tempted.	10	OEB
Hebrews	3	1	Therefore, my Christian friends, you who, all alike, have received the call from heaven, fix your attention on Jesus, the apostle and high priest of our religion.	10	OEB
Hebrews	3	2	See how faithful he was to the God who appointed him, as Moses was in the whole house of God.	10	OEB
Hebrews	3	3	He has been deemed worthy of far higher honor than Moses, just as the founder of the house is held in greater regard than the house itself.	10	OEB
Hebrews	3	4	For every house has its founder, and the founder of the universe is God.	10	OEB
Hebrews	3	5	While the faithful service of Moses in the whole house of God was that of a servant, whose duty was to bear testimony to a message still to come,	10	OEB
Hebrews	3	6	the faithfulness of Christ was that of a son set over the house of God. And we are his house – if only we retain, unshaken to the end, the courage and confidence inspired by our hope.	10	OEB
Hebrews	3	7	Therefore, as the Holy Spirit says –	10	OEB
Hebrews	3	8	harden not your hearts, as when Israel provoked me	10	OEB
Hebrews	3	9	Where your ancestors tried my forbearance,	10	OEB
Hebrews	3	10	Therefore I was sorely vexed with that generation,	10	OEB
Hebrews	3	11	While in my wrath I swore –	10	OEB
Hebrews	3	12	Be careful, friends, that there is never found in anyone of you a wicked and faithless heart, shown by that person separating themselves from the living God.	10	OEB
Hebrews	3	13	Rather encourage one another daily – while there is a today – to prevent anyone among you from being hardened by the deceitfulness of sin.	10	OEB
Hebrews	3	14	For we now all share in the Christ, if indeed we retain, unshaken to the end, the confidence that we had at the first.	10	OEB
Hebrews	3	15	To use the words of scripture –	10	OEB
Hebrews	3	16	Who were they who heard God speak and yet provoked him? Were not they all those who left Egypt under the leadership of Moses?	10	OEB
Hebrews	3	17	And with whom was it that God was sorely vexed for forty years? Was not it with those who had sinned, and who fell dead in the desert?	10	OEB
Hebrews	3	18	And who were they to whom God swore that they should not enter upon his rest, if not those who had proved faithless?	10	OEB
Hebrews	3	19	We see, then, that they failed to enter upon it because of their want of faith.	10	OEB
Hebrews	4	1	We must, therefore, be very careful, though there is a promise still standing that we will enter upon God’s rest, that none of you even appear to have missed it.	10	OEB
Hebrews	4	2	For we have had the good news told us just as they had. But the message which they heard did them no good, since they did not share the faith of those who were attentive to it.	10	OEB
Hebrews	4	3	Upon that rest we who have believed are now entering. As God has said –	10	OEB
Hebrews	4	4	for, in a passage referring to the seventh day, you will find these words –	10	OEB
Hebrews	4	5	On the other hand, we read in that passage –	10	OEB
Hebrews	4	6	Since, then, there is still a promise that some will enter upon this rest, and since those who were first told the good news did not enter upon it, because of their disbelief,	10	OEB
Hebrews	4	7	again God fixed a day. ‘Today,’ he said, speaking after a long interval through the mouth of David, in the passage already quoted –	10	OEB
Hebrews	4	8	Now if Joshua had given ‘rest’ to the people, God would not have spoken of another and later day.	10	OEB
Hebrews	4	9	There is, then, a Sabbath rest still awaiting God’s people.	10	OEB
Hebrews	4	10	For the person who enters upon God’s rest do themselves rest after their work, just as God did.	10	OEB
Hebrews	4	11	Let us, therefore, make every effort to enter upon that rest, so that none of us fall through such disbelief as that of which we have had an example.	10	OEB
Hebrews	4	12	God’s message is a living and active power, sharper than any two-edged sword, piercing its way until it penetrates soul and spirit – not the joints only but the marrow – and detecting the inmost thoughts and purposes of the mind.	10	OEB
Hebrews	4	13	There is no created thing that can hide itself from the sight of God. Everything is exposed and laid bare before the eyes of him to whom we have to give account.	10	OEB
Hebrews	4	14	We have, then, in Jesus, the Son of God, a great high priest who has passed into the highest heaven; let us, therefore, hold fast to the faith which we have professed.	10	OEB
Hebrews	4	15	Our high priest is not one unable to sympathize with our weaknesses, but one who has in every way been tempted, exactly as we have been, but without sinning.	10	OEB
Hebrews	4	16	Therefore, let us draw near boldly to the throne of love, to find pity and love for the hour of need.	10	OEB
Hebrews	5	1	Every high priest, taken from among the people, is appointed as their representative in their relations with God, to offer both gifts and sacrifices in expiation of sins.	10	OEB
Hebrews	5	2	And he is able to sympathize with the ignorant and deluded, since he is himself subject to weakness,	10	OEB
Hebrews	5	3	and is therefore bound to offer sacrifices for sins, not only for the people, but equally so for himself.	10	OEB
Hebrews	5	4	Nor does anyone take that high office on themselves, until they have been called to do so by God, as Aaron was.	10	OEB
Hebrews	5	5	In the same way, even the Christ did not take the honor of the high priesthood on himself, but he was appointed by him who said to him –	10	OEB
Hebrews	5	6	and on another occasion also –	10	OEB
Hebrews	5	7	Jesus, in the days of his earthly life, offered prayers and supplications, with earnest cries and with tears, to him who was able to save him from death; and he was heard because of his devout submission.	10	OEB
Hebrews	5	8	Son though he was, he learned obedience from his sufferings;	10	OEB
Hebrews	5	9	and, being made perfect, he became to all those who obey him the source of eternal salvation,	10	OEB
Hebrews	5	10	while God himself pronounced him a high priest of the order of Melchizedek.	10	OEB
Hebrews	5	11	Now on this subject I have much to say, but it is difficult to explain it to you, because you have shown yourselves so slow to learn.	10	OEB
Hebrews	5	12	For whereas, considering the time that has elapsed, you ought to be teaching others, you still need someone to teach you the alphabet of the divine revelation, and need again to be fed with milk instead of with ‘solid food.’	10	OEB
Hebrews	5	13	For everyone who still has to take milk knows nothing of the teaching of righteousness; they are a mere infant.	10	OEB
Hebrews	5	14	But solid food is for Christians of mature faith – those whose faculties have been trained by practice to distinguish right from wrong.	10	OEB
Hebrews	6	1	Therefore, let us leave behind the elementary teaching about the Christ and press on to perfection, not always laying over again a foundation of repentance for a lifeless formality, of faith in God –	10	OEB
Hebrews	6	2	teaching concerning baptisms and the laying on of hands, the resurrection of the dead and a final judgment.	10	OEB
Hebrews	6	3	Yes and, with God’s help, we will.	10	OEB
Hebrews	6	4	For if those who were once for all brought into the light, and learned to appreciate the gift from heaven, and came to share in the Holy Spirit,	10	OEB
Hebrews	6	5	and learned to appreciate the beauty of the divine message, and the new powers of the coming age –	10	OEB
Hebrews	6	6	if those, I say, fell away, it would be impossible to bring them again to repentance; they would be crucifying the Son of God over again for themselves, and exposing him to open contempt.	10	OEB
Hebrews	6	7	Ground that drinks in the showers that from time to time fall on it, and produces vegetation useful to those for whom it is tilled, receives a blessing from God;	10	OEB
Hebrews	6	8	but, if it bears thorns and thistles, it is regarded as worthless, it is in danger of being cursed, and its end will be the fire.	10	OEB
Hebrews	6	9	But about you, dear friends, even though we speak in this way, we are confident of better things – of things that point to your salvation.	10	OEB
Hebrews	6	10	For God is not unjust; he will not forget the work that you did, and the love that you showed for his name, in sending help to your fellow Christians – as you are still doing.	10	OEB
Hebrews	6	11	But our great desire is that every one of you should be equally earnest to attain to a full conviction that our hope will be fulfilled, and that you should keep that hope to the end.	10	OEB
Hebrews	6	12	Then you will not show yourselves slow to learn, but you will copy those who, through faith and patience, are now entering upon the enjoyment of God’s promises.	10	OEB
Hebrews	6	13	When God gave his promise to Abraham, since there was no one greater by whom he could swear, he swore by himself.	10	OEB
Hebrews	6	14	His words were –	10	OEB
Hebrews	6	15	And so, after patiently waiting, Abraham obtained the fulfillment of God’s promise.	10	OEB
Hebrews	6	16	People, of course, swear by what is greater than themselves, and with them an oath is accepted as putting a matter beyond all dispute.	10	OEB
Hebrews	6	17	And therefore God, in his desire to show, with unmistakable plainness, to those who were to enter on the enjoyment of what he had promised, the unchangeableness of his purpose, bound himself with an oath.	10	OEB
Hebrews	6	18	For he intended us to find great encouragement in these two unchangeable things, which make it impossible for God to prove false – we, I mean, who fled for safety where we might lay hold on the hope set before us.	10	OEB
Hebrews	6	19	This hope is an anchor for our souls, secure and strong, and it reaches into the sanctuary that lies behind the curtain,	10	OEB
Hebrews	6	20	where Jesus, our forerunner, has entered on our behalf, after being made for all time a high priest of the order of Melchizedek.	10	OEB
Hebrews	7	1	It was this Melchizedek, king of Salem and priest of the Most High God, who met Abraham returning from the slaughter of the kings, and gave him his blessing;	10	OEB
Hebrews	7	2	and it was to him that Abraham allotted a tithe of all the spoil. The meaning of his name is ‘king of righteousness,’ and besides that, he was also king of Salem, which means ‘king of peace.’	10	OEB
Hebrews	7	3	There is no record of his father, or mother, or lineage, nor again of any beginning of his days, or end of his life. In this he resembles the Son of God, and stands before us as a priest whose priesthood is continuous.	10	OEB
Hebrews	7	4	Consider, then the importance of this Melchizedek, to whom even the patriarch Abraham himself gave a tithe of the choicest spoils.	10	OEB
Hebrews	7	5	Those descendants of Levi, who are from time to time appointed to the priesthood, are directed to collect tithes from the people in accordance with the Law – that is from their own kindred, although they also are descended from Abraham.	10	OEB
Hebrews	7	6	But Melchizedek, although not of this lineage, received tithes from Abraham, and gave his blessing to the man who had God’s promises.	10	OEB
Hebrews	7	7	Now no one can dispute that it is the superior who blesses the inferior.	10	OEB
Hebrews	7	8	In the one case the tithes are received by people who are mortal; in the other case by one about whom there is the statement that his life still continues.	10	OEB
Hebrews	7	9	Moreover, in a sense, even Levi, who is the receiver of the tithes, has, through Abraham, paid tithes;	10	OEB
Hebrews	7	10	for Levi was still in the body of his ancestor when Melchizedek met Abraham.	10	OEB
Hebrews	7	11	If, then, perfection had been attainable through the Levitical priesthood – and it was under this priesthood that the people received the Law – why was it still necessary that a priest of a different order should appear, a priest of the order of Melchizedek and not of the order of Aaron?	10	OEB
Hebrews	7	12	With the change of the priesthood a change of the Law became a necessity.	10	OEB
Hebrews	7	13	And he of whom all this is said belonged to quite a different tribe, no member of which has ever served at the altar.	10	OEB
Hebrews	7	14	For it is plain that our Lord had sprung from the tribe of Judah, though of that tribe Moses said nothing about their being priests.	10	OEB
Hebrews	7	15	All this becomes even yet plainer when we remember that a new priest has appeared, resembling Melchizedek,	10	OEB
Hebrews	7	16	and that he was appointed, not under a Law regulating only earthly matters, but by virtue of a life beyond the reach of death;	10	OEB
Hebrews	7	17	for that is the meaning of the declaration –	10	OEB
Hebrews	7	18	On the one hand, we have the abolition of a previous regulation as being both inefficient and useless	10	OEB
Hebrews	7	19	(for the Law never brought anything to perfection); and, on the other hand, we have the introduction of a better hope, which enables us to draw near to God.	10	OEB
Hebrews	7	20	Then again, the appointment of this new priest was ratified by an oath, which is not so with the Levitical priests,	10	OEB
Hebrews	7	21	but his appointment was ratified by an oath, when God said to him –	10	OEB
Hebrews	7	22	And the oath shows the corresponding superiority of the covenant of which Jesus is appointed the surety.	10	OEB
Hebrews	7	23	Again, new Levitical priests are continually being appointed, because death prevents their remaining in office;	10	OEB
Hebrews	7	24	but Jesus remains for all time, and therefore the priesthood that he holds will never pass to another.	10	OEB
Hebrews	7	25	And that is why he is able to save perfectly those who come to God through him, living for ever, as he does, to intercede of their behalf.	10	OEB
Hebrews	7	26	This was the high priest that we needed – holy, innocent, spotless, withdrawn from sinners, exalted above the highest heaven,	10	OEB
Hebrews	7	27	one who has no need to offer sacrifices daily as those high priests have, first for their own sins, and then for those of the people. For this he did once and for all, when he offered himself as the sacrifice.	10	OEB
