Book	Chapter	Verse	Text	Index	Version
Psalms	21	13	Be exalted, LORD, in your strength, to your might we shall sing and make music.	15	OEB
Psalms	22	1	My God, my God, why have you left me, my rescue so far from the words of my roaring?	15	OEB
Psalms	22	2	I cry in the day, you do not answer, I cry in the night but find no rest.	15	OEB
Psalms	22	3	You are the Holy One, throned on the praises of Israel.	15	OEB
Psalms	22	4	In you our ancestors trusted, they trusted and you delivered them.	15	OEB
Psalms	22	5	They cried to you, and found safety, in you did they trust and were not put to shame.	15	OEB
Psalms	22	6	But I am a worm, not a person; insulted by others, despised by the people.	15	OEB
Psalms	22	7	All who see me mock me, with mouths wide open and wagging heads:	15	OEB
Psalms	22	8	“He relies on the LORD ; let him save him. Let him rescue the one he holds dear!”	15	OEB
Psalms	22	9	But you drew me from the womb, laid me safely on my mother’s breasts.	15	OEB
Psalms	22	10	On your care was I cast from my very birth, you are my God from my mother’s womb.	15	OEB
Psalms	22	11	Be not far from me, for trouble is nigh, and there is none to help.	15	OEB
Psalms	22	12	I am circled by many bulls, beset by the mighty of Bashan,	15	OEB
Psalms	22	13	who face me with gaping jaws, like ravening roaring lions.	15	OEB
Psalms	22	14	Poured out am I like water, and all my bones are loosened. My heart is become like wax, melted within me.	15	OEB
Psalms	22	15	My palate is dry as a sherd, my tongue sticks to my jaws; in the dust of death you lay me.	15	OEB
Psalms	22	16	For dogs are round about me, a band of knaves encircles me, gnawing my hands and my feet.	15	OEB
Psalms	22	17	I can count my bones, every one. As for them, they feast their eyes on me.	15	OEB
Psalms	22	18	They divide my garments among them, and over my raiment cast lots.	15	OEB
Psalms	22	19	But you, O LORD, be not far, O my strength, hasten to help me.	15	OEB
Psalms	22	20	Deliver my life from the sword my life from the power of the dogs.	15	OEB
Psalms	22	21	Save me from the jaws of the lion, from the horns of the wild oxen help me.	15	OEB
Psalms	22	22	I will tell of your fame to my kindred, and in the assembly will praise you.	15	OEB
Psalms	22	23	Praise the LORD, you who fear him. All Jacob’s seed, give him glory. All Israel’s seed, stand in awe of him.	15	OEB
Psalms	22	24	For he has not despised nor abhorred the sorrow of the sorrowful. He hid not his face from me, but he listened to my cry for help.	15	OEB
Psalms	22	25	Of you is my praise in the great congregation; my vows I will pay before those who fear him.	15	OEB
Psalms	22	26	The afflicted will eat to their heart’s desire, and those who seek after the LORD  will praise him. Lift up your hearts forever.	15	OEB
Psalms	22	27	All will call it to mind, to the ends of the earth, and turn to the LORD ; and all tribes of the nations will bow down before you.	15	OEB
Psalms	22	28	For the kingdom belongs to the LORD : he is the LORD  of the nations.	15	OEB
Psalms	22	29	To him will bow down all who sleep in the earth, and before him bend all who go down to the dust, and those who could not preserve their lives.	15	OEB
Psalms	22	30	My descendants will tell of the LORD to the next generation;	15	OEB
Psalms	22	31	they will declare his righteousness to people yet to be born: He has done it.	15	OEB
Psalms	23	1	The LORD  is my shepherd: I am never in need.	15	OEB
Psalms	23	2	He lays me down in green pastures. He gently leads me to waters of rest,	15	OEB
Psalms	23	3	he refreshes my life. He guides me along paths that are straight, true to his name.	15	OEB
Psalms	23	4	And when my way lies through a valley of gloom, I fear no evil, for you are with me. Your rod and your staff comfort me.	15	OEB
Psalms	23	5	You spread a table for me in face of my foes; with oil you anoint my head, and my cup runs over.	15	OEB
Psalms	23	6	Surely goodness and love will pursue me – all the days of my life. In the house of the LORD  I will live through the length of the days.	15	OEB
Psalms	24	1	The earth is the LORD ’s and all that it holds, the world and those who live in it.	15	OEB
Psalms	24	2	For he founded it on the seas, and on the floods he sustains it.	15	OEB
Psalms	24	3	Who may ascend the hill of the LORD ? Who may stand in his holy place?	15	OEB
Psalms	24	4	The clean of hands, the pure of heart, who sets not their heart upon sinful things, nor swears with intent to deceive:	15	OEB
Psalms	24	5	they win from the LORD  a blessing: God is their champion and savior.	15	OEB
Psalms	24	6	Such must be those who resort to him, and seek the face of the God of Jacob. *Selah*  ##### The Lords’s Triumphal Entry into the Sanctuary #####	15	OEB
Psalms	24	7	Lift high your heads, you gates – Higher, you ancient doors; welcome the glorious king.	15	OEB
Psalms	24	8	“Who is the glorious king?” “The LORD  strong and heroic, the LORD  heroic in battle.”	15	OEB
Psalms	24	9	Lift high your heads, you gates – Higher, you ancient doors; welcome the glorious king.	15	OEB
Psalms	24	10	“Who is the glorious king?” “The LORD, the God of hosts, he is the glorious king.” *Selah*	15	OEB
Psalms	25	1	To you, O LORD, I lift up my heart: all the day I wait for you.	15	OEB
Psalms	25	2	In you I trust, put me not to shame; let not my foes exult over me.	15	OEB
Psalms	25	3	None will be shamed who wait for you, but shame will fall upon wanton traitors.	15	OEB
Psalms	25	4	Make me, O LORD, to know your ways: teach me your paths.	15	OEB
Psalms	25	5	In your faithfulness guide me and teach me, for you are my God and my savior.	15	OEB
Psalms	25	6	Remember your pity, O LORD, and your kindness, for they have been ever of old.	15	OEB
Psalms	25	7	Do not remember the sins of my youth; remember me in kindness, because of your goodness, LORD .	15	OEB
Psalms	25	8	Good is the LORD  and upright, so he teaches sinners the way.	15	OEB
Psalms	25	9	The humble he guides in the right, he teaches the humble his way.	15	OEB
Psalms	25	10	All his ways are loving and loyal to those who observe his charges and covenant.	15	OEB
Psalms	25	11	Be true to your name LORD, forgive my many sins.	15	OEB
Psalms	25	12	Who then is the person who fears the LORD ? He will teach them the way to choose.	15	OEB
Psalms	25	13	They will live in prosperity, their children will inherit the land.	15	OEB
Psalms	25	14	The LORD  gives guidance to those who fear him, and with his covenant he makes them acquainted.	15	OEB
Psalms	25	15	My eyes are ever toward the LORD, for out of the net he brings my foot.	15	OEB
Psalms	25	16	Turn to me with your favor, for I am lonely and crushed	15	OEB
Psalms	25	17	In my heart are strain and storm; bring me out of my distresses.	15	OEB
Psalms	25	18	Look on my misery and trouble, and pardon all my sins,	15	OEB
Psalms	25	19	look on my foes oh, so many! And their cruel hatred towards me.	15	OEB
Psalms	25	20	Deliver me, keep me, and shame not one who takes refuge in you.	15	OEB
Psalms	25	21	May integrity and innocence preserve me, for I wait for you, O LORD .	15	OEB
Psalms	25	22	Redeem Israel, O God, from all its distresses.	15	OEB
Psalms	26	1	Defend me, O LORD, for my walk has been blameless; in the LORD  have I trusted unswervingly:	15	OEB
Psalms	26	2	Examine me, LORD, and test me; test my heart and my mind.	15	OEB
Psalms	26	3	For your love is before my eyes, and your faithfulness governs my way.	15	OEB
Psalms	26	4	I never sat down with the worthless, nor companied with dissemblers.	15	OEB
Psalms	26	5	I hate the assembly of knaves, I would never sit down with the wicked;	15	OEB
Psalms	26	6	but, with hands washed in innocence, I would march round your altar, O LORD,	15	OEB
Psalms	26	7	singing loud songs of thanks, and telling of all your wonders.	15	OEB
Psalms	26	8	O LORD, I love your house, the place where your glory lives.	15	OEB
Psalms	26	9	Do not gather me up with sinners; slay me not with people of blood,	15	OEB
Psalms	26	10	whose hands are stained with villainy, and whose right hand is filled with bribes.	15	OEB
Psalms	26	11	But my walk is blameless! O redeem me, be gracious to me.	15	OEB
Psalms	26	12	My foot stands on even ground, in the choirs I will bless the LORD .	15	OEB
Psalms	27	1	The LORD  is my light and my savior; whom then should I fear? The LORD  protects my life; whom then should I dread?	15	OEB
Psalms	27	2	When the wicked drew near to assail me and eat up my flesh, it was those who distressed and opposed me who stumbled and fell.	15	OEB
Psalms	27	3	Though against me a host should encamp, yet my heart would be fearless: though battle should rise up against me, still would I be trustful.	15	OEB
Psalms	27	4	One thing have I asked of the LORD, and that do I long for – To live in the house of the LORD all the days of my life, to gaze on the grace of the LORD and inquire in his temple.	15	OEB
Psalms	27	5	For he will hide me in his shelter in the day of misfortune. In his sheltering tent he hides me: he lifts me up on a rock.	15	OEB
Psalms	27	6	And now that my head he has lifted above my encircling foes, I will march round the altar and sacrifice, shouting with joy, in his tent, making music and song to the LORD .  ##### The Serenity of Faith #####	15	OEB
Psalms	27	7	Hear, O LORD, my loud cry, and graciously answer me.	15	OEB
Psalms	27	8	My heart has said to you, “Your face, O LORD, I seek.”	15	OEB
Psalms	27	9	Hide not your face from me, reject not your servant in anger: for you have been my help. Abandon me not, nor forsake me, O God of my help:	15	OEB
Psalms	27	10	for father and mother have left me; but the LORD  will take me up.	15	OEB
Psalms	27	11	Teach me your way, O LORD : lead me in an even path, because of my enemies.	15	OEB
Psalms	27	12	Give me not up, O LORD, unto the rage of my foes; for against me have risen false witnesses, breathing out cruelty.	15	OEB
Psalms	27	13	Firm is the faith I cherish, that I, in the land of the living, will yet see the goodness of God.	15	OEB
Psalms	27	14	Let your heart be courageous and strong, and wait on the LORD .	15	OEB
Psalms	28	1	Unto you, O LORD, do I cry; my rock, be not deaf to me: lest, through holding your peace, I become like those who go down to the pit.	15	OEB
Psalms	28	2	Hear my loud entreaty, as I cry for help to you, lifting my hands, O LORD, towards your holy chancel.	15	OEB
Psalms	28	3	Take me not off with the wicked, nor with the workers of wrong, whose speech to their neighbors is friendly, while evil is in their heart.	15	OEB
Psalms	28	4	Give them as they have done, as their wicked deeds deserve. As their hands have wrought, so give to them: requite to them their deserts.	15	OEB
Psalms	28	5	They are blind to all that the LORD  does, to all that his hands have wrought; and so he will tear them down, to build them up no more.	15	OEB
Psalms	28	6	Blest be the LORD, who has heard my voice as I plead for mercy.	15	OEB
Psalms	28	7	The LORD  is my strength and my shield; my heart trusts in him. I was helped: so my heart is exultant, and in my song I will praise him.	15	OEB
Psalms	28	8	The LORD  is the strength of his people, the fortress who saves his anointed.	15	OEB
Psalms	28	9	O save your people, and bless your inheritance. Be their shepherd and carry them forever.	15	OEB
Psalms	29	1	Ascribe to the LORD, you heavenly beings, ascribe to the LORD  glory and power	15	OEB
Psalms	29	2	Ascribe to the LORD  the glory he manifests: bow to the LORD  in holy array.	15	OEB
Psalms	29	3	The LORD ’s voice peals on the waters. The God of glory has thundered. He peals o’er the mighty waters.	15	OEB
Psalms	29	4	The LORD ’s voice sounds with strength, the LORD ’s voice sounds with majesty.	15	OEB
Psalms	29	5	The LORD ’s voice breaks the cedars, he breaks the cedars of Lebanon,	15	OEB
Psalms	29	6	making Lebanon dance like a calf, Sirion like a young wild ox.	15	OEB
Psalms	29	7	The LORD ’s voice hews out flames of fire.	15	OEB
Psalms	29	8	The LORD ’s voice rends the desert, he rends the desert of Kadesh.	15	OEB
Psalms	29	9	The LORD ’s voice whirls the oaks, and strips the forests bare; and all in his temple say “Glory.”	15	OEB
Psalms	29	10	The LORD  was king at the flood, the LORD  sits throned forever.	15	OEB
Psalms	29	11	The LORD  gives strength to his people, he blesses his people with peace.	15	OEB
Psalms	30	1	I will extol you, O LORD, because you have lifted me up, and not suffered my foes to rejoice over me.	15	OEB
Psalms	30	2	I cried to you for help, O LORD  my God, and you healed me.	15	OEB
Psalms	30	3	You have brought me up, LORD, from Sheol, from my way to the pit back to life you have called me.	15	OEB
Psalms	30	4	Sing praise to the LORD, faithful people; give thanks to his holy name.	15	OEB
Psalms	30	5	For his anger lasts only a moment, his favor endures for a lifetime. Weeping may lodge for the night, but the morning brings shouts of joy.	15	OEB
Psalms	30	6	When all went well, I imagined that never should I be shaken.	15	OEB
Psalms	30	7	For by your favor, O LORD, you had set me on mountains strong: but you hide your face, and I was confounded.	15	OEB
Psalms	30	8	Then to you, LORD, I cried, to the LORD  I begged for mercy,	15	OEB
Psalms	30	9	“What profit is there in my blood, if I go down to the pit? Can you be praised by dust? Can it tell of your faithfulness?	15	OEB
Psalms	30	10	Hear, LORD, and show me your favor, LORD  be a helper to me.”	15	OEB
Psalms	30	11	You have turned my mourning to dancing; my sackcloth you have unloosed, and clothed me with joy:	15	OEB
Psalms	30	12	that unceasingly I should sing your praise, and give thanks to you, LORD  my God, forever.	15	OEB
Psalms	31	1	In you, O LORD, I take refuge; let me never be put to shame. Rescue me in your faithfulness;	15	OEB
Psalms	31	2	incline to me your ear. Deliver me speedily. Be to me a rock of defence, a fortified house, to save me.	15	OEB
Psalms	31	3	For my rock and my fortress are you; lead me and guide me so your name will be honored.	15	OEB
Psalms	31	4	Draw me out of the net they have hid for me, for you yourself are my refuge.	15	OEB
Psalms	31	5	Into your hand I commend my spirit: you ransom me, LORD, faithful God.	15	OEB
Psalms	31	6	I hate those devoted to worthless idols; I trust in the LORD .	15	OEB
Psalms	31	7	I will rejoice and be glad in your love, because you have looked on my misery, and cared for me in my distress.	15	OEB
Psalms	31	8	You have not given me into the enemy’s hand, you have set my feet in a spacious place.	15	OEB
Psalms	31	9	Be gracious to me, LORD, for I am distressed; my eye is wasted away with sorrow.	15	OEB
Psalms	31	10	For my life is consumed with grief, and my years with sighing. My strength is broken with misery, my bones waste away.	15	OEB
Psalms	31	11	The scorn of all my foes, the butt of my neighbors am I, a terror to my acquaintance. At the sight of me in the street people turn quickly away.	15	OEB
Psalms	31	12	I am clean forgotten like the dead, am become like a ruined vessel.	15	OEB
Psalms	31	13	I hear the whispers of many – terror on every side – scheming together against me, plotting to take my life.	15	OEB
Psalms	31	14	But my trust is in you, LORD . “You are my God,” I say;	15	OEB
Psalms	31	15	my times are in your hand, save me from the hand of the foes who pursue me.	15	OEB
Psalms	31	16	Make your face to shine on your servant, save me in your love.	15	OEB
Psalms	31	17	Put me not, O LORD, to shame, for I have called upon you. Let the wicked be put to shame silent in Sheol.	15	OEB
Psalms	31	18	Strike the false lips dumb, that speak proudly against the righteous with haughtiness and contempt.	15	OEB
Psalms	31	19	How great is the goodness you have treasured for those who fear you, and wrought for those who take refuge in you, in plain sight of all!	15	OEB
Psalms	31	20	In your sheltering wings you hide them from plottings of people, you keep them safe in a bower from the chiding of tongues.	15	OEB
Psalms	31	21	Blest be the LORD for the wonderful love he has shown me in time of distress.	15	OEB
Psalms	31	22	For I had said in panic, “I am driven clean out of your sight.” But you heard my plea, when I cried to you for help.	15	OEB
Psalms	31	23	Love the LORD, all you faithful; the LORD  protects the loyal, but repays the haughty in full.	15	OEB
Psalms	31	24	Let your hearts be courageous and strong, all you who wait on the LORD .	15	OEB
Psalms	32	1	Happy those whose transgression is pardoned, whose sin is covered.	15	OEB
Psalms	32	2	Happy are those, free from falseness of spirit, to whom the LORD  reckons no debt of guilt.	15	OEB
Psalms	32	3	When I held my peace, my bones wore away with my endless groaning;	15	OEB
Psalms	32	4	for day and night did your hand lie heavy upon me. The sap of my life was dried up as with fierce summer-heat. *Selah*	15	OEB
Psalms	32	5	I began to acknowledge my sin, not concealing my guilt; and the moment I vowed to confess to the LORD  my transgression, then you yourself did pardon the guilt of my sin. *Selah*	15	OEB
Psalms	32	6	For this cause let all who are faithful pray to you in the time of distress; then, when the great waters rush, they will not reach to him.	15	OEB
Psalms	32	7	For you are my shelter, you protect me from trouble, and surround me with deliverance. *Selah*	15	OEB
Psalms	32	8	“With my eye steadfastly upon you, I will instruct and teach you The way you should go.	15	OEB
Psalms	32	9	Do not be like the horse or the mule, that have no understanding, but need bridle and halter to curb them, else they will not come near to you.”	15	OEB
Psalms	32	10	The godless have many sorrows, but those who trust in the LORD will be compassed about by his kindness.	15	OEB
Psalms	32	11	Be glad in the LORD, and rejoice, you righteous; and ring out your joy, all you upright in heart.	15	OEB
Psalms	33	1	Shout for joy in the LORD, you righteous: praise for the upright is seemly.	15	OEB
Psalms	33	2	Give thanks to the LORD  on the lyre, play to him on a ten-stringed harp.	15	OEB
Psalms	33	3	Sing to him a new song, play skilfully and shout merrily.	15	OEB
Psalms	33	4	For the LORD  is straight in his promise; and all that he does is in faithfulness.	15	OEB
Psalms	33	5	Justice and right he loves; the earth is full of his kindness.	15	OEB
Psalms	33	6	By his word the heavens were made, all their host by the breath of his mouth.	15	OEB
Psalms	33	7	He gathers the sea in a bottle, the ocean he puts into store-houses.	15	OEB
Psalms	33	8	Let the whole world honor the LORD, let all who live on earth be in awe.	15	OEB
Psalms	33	9	For at his word it came into being, at his command it stood forth.	15	OEB
Psalms	33	10	The LORD  frustrates the designs of the nations, what the peoples have purposed, he brings to nought,	15	OEB
Psalms	33	11	but the LORD ’s own design will stand forever, and what his heart has purposed, through all generations.	15	OEB
Psalms	33	12	Happy the nation whose God is the LORD, the people he chose for himself as his own.	15	OEB
Psalms	33	13	The LORD  looks down from heaven, he sees all of humanity;	15	OEB
Psalms	33	14	from where he rules he gazes on all who inhabit the earth.	15	OEB
Psalms	33	15	He fashions the hearts of them all, and gives heed to all that they do.	15	OEB
Psalms	33	16	It is not by great armies that kings are victorious, it is not by great strength that a warrior saves himself;	15	OEB
Psalms	33	17	false hope is the war-horse to usher in victory, for all its great might it can provide no escape.	15	OEB
Psalms	33	18	See! The eye of the LORD  is on those who fear him, on those who hope in his kindness;	15	OEB
Psalms	33	19	to deliver their life from death, and to keep them alive in famine.	15	OEB
Psalms	33	20	We wait for the LORD : he is our help and our shield.	15	OEB
Psalms	33	21	For in him our heart is glad, we trust in his holy name.	15	OEB
Psalms	33	22	Let your kindness, O LORD, be upon us, as is our hope in you.	15	OEB
Psalms	34	1	I will bless the LORD  at all times, in my mouth will his praise be forever.	15	OEB
Psalms	34	2	In the LORD  will my heart make her boast, the humble will hear and be glad.	15	OEB
Psalms	34	3	O magnify the LORD  with me and let us extol his name together.	15	OEB
Psalms	34	4	I sought the LORD, and, in answer, he saved me from all my terrors.	15	OEB
Psalms	34	5	Look to him and you will be radiant, with faces unashamed.	15	OEB
Psalms	34	6	Here is one who was crushed, but cried and was heard by the LORD, and brought safe out of every trouble.	15	OEB
Psalms	34	7	The LORD ’s angel encamps about those who fear him, and rescues them.	15	OEB
Psalms	34	8	O taste and see that the LORD  is good, happy those who take refuge in him.	15	OEB
Psalms	34	9	Fear the LORD, all his people, for they who fear him lack nothing.	15	OEB
Psalms	34	10	Even young lions may be poor and hungry, but those who seek the LORD will not lack any good thing.	15	OEB
Psalms	34	11	Come, children, listen to me. I will teach you the fear of the LORD .	15	OEB
Psalms	34	12	Which of you is desirous of life, loves many and happy days?	15	OEB
Psalms	34	13	Then guard your tongue from evil, and your lips from speaking deceit.	15	OEB
Psalms	34	14	Depart from evil, and do good; seek peace, and pursue it.	15	OEB
Psalms	34	15	The eyes of the LORD  are towards the righteous, his ears are towards their cry for help.	15	OEB
Psalms	34	16	The LORD  sets his face against those who do evil, to root their memory out of the earth.	15	OEB
Psalms	34	17	When righteous cry, they are heard by the LORD, and he saves them from all their distresses.	15	OEB
Psalms	34	18	The LORD  is near to the broken-hearted, he helps those whose spirit is crushed.	15	OEB
Psalms	34	19	Many misfortunes befall the righteous, but the LORD  delivers them out of them all.	15	OEB
Psalms	34	20	He guards all their bones, none are broken.	15	OEB
Psalms	34	21	Misfortune will slay the ungodly; those who hate the righteous are doomed.	15	OEB
Psalms	34	22	The LORD  ransoms the life of his servants, and none will be doomed who takes refuge in him.	15	OEB
Psalms	35	1	Contend, LORD, with those who contend with me, do battle with those who do battle with me.	15	OEB
Psalms	35	2	Grasp shield and buckler, and rise up as my help.	15	OEB
Psalms	35	3	Draw spear and battle-axe, confront those who pursue me. Assure me that you will help me.	15	OEB
Psalms	35	4	Dishonor and shame be on those who are seeking my life! Defeat and confusion on those who are planning my hurt!	15	OEB
Psalms	35	5	As chaff before wind may they be, with the LORD ’s angel pursuing them.	15	OEB
Psalms	35	6	Slippery and dark be their way, with his angel thrusting them on.	15	OEB
Psalms	35	7	For they wantonly hid their net for me, and dug a pit to destroy me.	15	OEB
Psalms	35	8	Upon them may ruin come unawares; may the net which they hid catch themselves, and into the pit may they fall.	15	OEB
Psalms	35	9	Then I will exult in the LORD, and be joyful because of his help;	15	OEB
Psalms	35	10	and all my being will say, “Who, O LORD, is like you, who save the helpless from those too strong for them, the poor and the helpless from those who despoil them?”	15	OEB
Psalms	35	11	Violent witnesses rise, and ask of me things that I know not.	15	OEB
Psalms	35	12	Evil for good they requite me, leaving me inwardly comfortless.	15	OEB
Psalms	35	13	But when *they* were sick, *I* put on sackcloth, and chastened myself with fasting. I prayed with head bowed low,	15	OEB
Psalms	35	14	as if for my friend or my brother. I went about bowed and in mourning, as one who laments his mother.	15	OEB
Psalms	35	15	When I stumbled, they gleefully gathered, strangers gathered around me, and tore at me without ceasing,	15	OEB
Psalms	35	16	impiously mocking and mocking, bearing their teeth at me.	15	OEB
Psalms	35	17	How long, LORD, will you look on? Rescue me from their roaring, my precious life from the lions.	15	OEB
Psalms	35	18	I will then give you thanks in the great congregation, and praise you before many people.	15	OEB
Psalms	35	19	Suffer not those to rejoice over me who are falsely my foes, suffer not those who without cause abhor me to wink with the eye.	15	OEB
Psalms	35	20	For it is not peace that they speak of those who are quiet in the land; but treacherous charges they plot.	15	OEB
Psalms	35	21	With wide open mouths they shout, “Hurrah! Hurrah! With our own eyes we saw it.”	15	OEB
Psalms	35	22	But you have seen, too, O LORD, keep not silence, O LORD, be not far from me.	15	OEB
Psalms	35	23	Bestir you, awake, for my right my God, my LORD, for my cause.	15	OEB
Psalms	35	24	You are just, LORD : win for me justice, let them not rejoice over me,	15	OEB
Psalms	35	25	inwardly saying, “Hurrah! The desire of our hearts at last! Now we have swallowed him up.”	15	OEB
Psalms	35	26	Shame and confusion together on those who rejoice at my hurt! Clothed with shame and dishonor be those who are haughty to me!	15	OEB
Psalms	35	27	Let such as delight in my cause ring out their gladness, and say evermore, “Great is the LORD  whose delight is the well-being of his servant.”	15	OEB
Psalms	35	28	Then my tongue will tell of your justice, and all the day long of your praise.	15	OEB
Psalms	36	1	Sin whispers within the heart of the wicked, who have no dread of God before their eyes.	15	OEB
Psalms	36	2	It flatters them in their eyes that their sin will not be found out.	15	OEB
Psalms	36	3	First, their speech becomes wicked and false, they give up acting wisely and well.	15	OEB
Psalms	36	4	Then they plot deliberate wrong, take their stand on the wicked way, without the least shrinking from evil.	15	OEB
Psalms	36	5	Your love, O LORD, touches the heavens, your faithfulness reaches the clouds.	15	OEB
Psalms	36	6	Your justice is like the great mountains, your judgments are like the broad sea. LORD, you save people and animals.	15	OEB
Psalms	36	7	How precious your love, O God! All may seek shelter in the shadow of your wings.	15	OEB
Psalms	36	8	They feast on the fat of your house, they drink of your brook of delights.	15	OEB
Psalms	36	9	For with you is the fountain of life, in the light that is yours we see light.	15	OEB
