Book	Chapter	Verse	Text	Index	Version
Romans	3	17	and the path of peace they do not know.’	16	OEB
Romans	3	18	‘The fear of God is not before their eyes.’	16	OEB
Romans	3	19	Now we know that everything said in the Law is addressed to those who are under its authority, in order that every mouth may be closed, and to bring the whole world under God’s judgment.	16	OEB
Romans	3	20	For no human being will be pronounced righteous before God as the result of obedience to Law; for it is Law that shows what sin is.	16	OEB
Romans	3	21	But now, quite apart from Law, the divine righteousness stands revealed, and to it the Law and the prophets bear witness –	16	OEB
Romans	3	22	the divine righteousness which is bestowed, through faith in Jesus Christ, on all, without distinction, who believe in him.	16	OEB
Romans	3	23	For all have sinned, and all fall short of God’s glorious ideal,	16	OEB
Romans	3	24	but, in his loving kindness, are being freely pronounced righteous through the deliverance found in Christ Jesus.	16	OEB
Romans	3	25	For God set him before the world, to be, by the shedding of his blood, a means of reconciliation through faith. And this God did to prove his righteousness, and because, in his forbearance, he had passed over the sins that people had previously committed;	16	OEB
Romans	3	26	as a proof, I repeat, at the present time, of his own righteousness, that he might be righteous in our eyes, and might pronounce righteous the person who takes their stand on faith in Jesus.	16	OEB
Romans	3	27	What, then, becomes of our boasting? It is excluded. By what sort of Law? A Law requiring obedience? No, a Law requiring faith.	16	OEB
Romans	3	28	For we conclude that a person is pronounced righteous on the ground of faith, quite apart from obedience to Law.	16	OEB
Romans	3	29	Or can it be that God is the God only of the Jews? Isn’t he also the God of the Gentiles?	16	OEB
Romans	3	30	Yes, of the Gentiles also, since there is only one God, and he will pronounce those who are circumcised righteous as the result of faith, and also those who are uncircumcised on their showing the same faith.	16	OEB
Romans	3	31	Do we, then, use this faith to abolish Law? Heaven forbid! No, we establish Law.	16	OEB
Romans	4	1	What then, it may be asked, are we to say about Abraham, the ancestor of our nation?	16	OEB
Romans	4	2	If he was pronounced righteous as the result of obedience, then he has something to boast of. Yes, but not before God.	16	OEB
Romans	4	3	For what are the words of scripture? ‘Abraham had faith in God, and his faith was regarded by God as righteousness.’	16	OEB
Romans	4	4	Now wages are regarded as due to the person who works, not as a favor, but as a debt;	16	OEB
Romans	4	5	while, as for the person who does not rely on their obedience, but has faith in him who can pronounce the godless righteous, their faith is regarded by God as righteousness.	16	OEB
Romans	4	6	In precisely the same way David speaks of the blessing pronounced on the person who is regarded by God as righteous apart from actions –	16	OEB
Romans	4	7	‘Blessed are those whose wrongdoings have been forgiven and over whose sins a veil has been drawn!	16	OEB
Romans	4	8	Blessed the man whom the Lord will never regard as sinful!’	16	OEB
Romans	4	9	Is this blessing, then, pronounced on the circumcised only or on the uncircumcised as well? We say that – ‘Abraham’s faith was regarded by God as righteousness.’	16	OEB
Romans	4	10	Under what circumstances, then, did this take place? After his circumcision or before it?	16	OEB
Romans	4	11	Not after, but before. And it was as a sign of this that he received the rite of circumcision – to show the righteousness due to the faith of an uncircumcised man – in order that he might be the father of all who have faith in God even when uncircumcised, so that they also may be regarded by God as righteous;	16	OEB
Romans	4	12	as well as father of the circumcised – to those who are not only circumcised, but who also follow our father Abraham in that faith which he had while still uncircumcised.	16	OEB
Romans	4	13	For the promise that he should inherit the world did not come to Abraham or his descendants through Law, but through the righteousness due to faith.	16	OEB
Romans	4	14	If those who take their stand on Law are to inherit the world, then faith is robbed of its meaning and the promise comes to nothing!	16	OEB
Romans	4	15	Law entails punishment; but, where no Law exists, no breach of it is possible.	16	OEB
Romans	4	16	That is why everything is made to depend on faith: so that everything may be God’s gift, and in order that the fulfillment of the promise may be made certain for all Abraham’s descendants – not only for those who take their stand on the Law, but also for those who take their stand on the faith of Abraham. (He is the father of us all;	16	OEB
Romans	4	17	as scripture says – ‘I have made you the father of many nations.’) And this they do in the sight of that God in whom Abraham had faith, and who gives life to the dead, and speaks of what does not yet exist as if it did.	16	OEB
Romans	4	18	With no ground for hope, Abraham, sustained by hope, put faith in God; in order that, in fulfillment of the words – ‘So many will your descendants be,’ he might become ‘the father of many nations.’	16	OEB
Romans	4	19	Though he was nearly a hundred years old, yet his faith did not fail him, even when he thought of his own body, then utterly worn out, and remembered that Sarah was past bearing children.	16	OEB
Romans	4	20	He was not led by want of faith to doubt God’s promise.	16	OEB
Romans	4	21	On the contrary, his faith gave him strength; and he praised God, in the firm conviction that what God has promised he is also able to carry out.	16	OEB
Romans	4	22	And therefore his faith ‘was regarded as righteousness.’	16	OEB
Romans	4	23	Now these words – ‘it was regarded as righteousness’ – were not written with reference to Abraham only;	16	OEB
Romans	4	24	but also with reference to us. Our faith, too, will be regarded by God in the same light, if we have faith in him who raised Jesus, our Lord, from the dead;	16	OEB
Romans	4	25	for Jesus was given up to death to atone for our offenses, and was raised to life that we might be pronounced righteous.	16	OEB
Romans	5	1	Therefore, having been pronounced righteous as the result of faith, let us enjoy peace with God through Jesus Christ, our Lord.	16	OEB
Romans	5	2	It is through him that, by reason of our faith, we have obtained admission to that place in God’s favor in which we now stand. So let us exult in our hope of attaining God’s glorious ideal.	16	OEB
Romans	5	3	And not only that, but let us also exult in our troubles;	16	OEB
Romans	5	4	for we know that trouble develops endurance, and endurance strength of character, and strength of character hope,	16	OEB
Romans	5	5	and that hope never disappoints. For the love of God has filled our hearts through the Holy Spirit which was given us;	16	OEB
Romans	5	6	seeing that, while we were still powerless, Christ, in God’s good time, died on behalf of the godless.	16	OEB
Romans	5	7	Even for an upright person scarcely anyone will die. For a really good person perhaps someone might even dare to die.	16	OEB
Romans	5	8	But God puts his love for us beyond all doubt by the fact that Christ died on our behalf while we were still sinners.	16	OEB
Romans	5	9	Much more, then, now that we have been pronounced righteous by virtue of the shedding of his blood, will we be saved through him from the wrath of God.	16	OEB
Romans	5	10	For if, when we were God’s enemies, we were reconciled to him through the death of his Son, much more, now that we have become reconciled, will we be saved by virtue of Christ’s life.	16	OEB
Romans	5	11	And not only that, but we exult in God, through Jesus Christ, our Lord, through whom we have now obtained this reconciliation.	16	OEB
Romans	5	12	Therefore, just as sin came into the world through one man, and through sin came death; so, also, death spread to all humanity, because every person has sinned.	16	OEB
Romans	5	13	Even before the time of the Law there was sin in the world; but sin cannot be charged against someone where no Law exists.	16	OEB
Romans	5	14	Yet, from Adam to Moses, death reigned even over those whose sin was not a breach of a law, as Adam’s was. And Adam foreshadows the one to come.	16	OEB
Romans	5	15	But there is a contrast between Adam’s offense and God’s gracious gift. For, if by reason of the offense of the one man the whole human race died, far more were the loving kindness of God, and the gift given in the loving kindness of the one man, Jesus Christ, lavished on the whole human race.	16	OEB
Romans	5	16	There is a contrast, too, between the gift and the results of the one man’s sin. The judgment, which followed on the one man’s sin, resulted in condemnation, but God’s gracious gift, which followed on many offenses, resulted in a decree of righteousness.	16	OEB
Romans	5	17	For if, by reason of the offense of the one man, death reigned through that one man, far more will those, on whom God’s loving kindness and his gift of righteousness are lavished, find life, and reign through the one man, Jesus Christ.	16	OEB
Romans	5	18	Briefly then, just as a single offense resulted for all humanity in condemnation, so, too, a single decree of righteousness resulted for all humanity in that declaration of righteousness which brings life.	16	OEB
Romans	5	19	For, as through the disobedience of the one man the whole human race was rendered sinful, so, too, through the obedience of the one, the whole human race will be rendered righteous.	16	OEB
Romans	5	20	Law was introduced in order that offenses might be multiplied. But, where sins were multiplied, the loving kindness of God was lavished the more,	16	OEB
Romans	5	21	in order that, just as sin had reigned in the realm of death, so, too, might loving-kindness reign through righteousness, and result in eternal life, through Jesus Christ, our Lord.	16	OEB
Romans	6	1	What are we to say, then? Are we to continue to sin, in order that God’s loving kindness may be multiplied?	16	OEB
Romans	6	2	Heaven forbid! We became dead to sin, so how can we go on living in it?	16	OEB
Romans	6	3	Or can it be that you do not know that all of us, who were baptized into union with Christ Jesus, in our baptism shared his death?	16	OEB
Romans	6	4	Consequently, through sharing his death in our baptism, we were buried with him; so that, just as Christ was raised from the dead by a manifestation of the Father’s power, so we also may live a new life.	16	OEB
Romans	6	5	If we have become united with him by the act symbolic of his death, surely we will also become united with him by the act symbolic of his resurrection.	16	OEB
Romans	6	6	We recognize the truth that our old self was crucified with Christ, in order that the body, the stronghold of sin, might be rendered powerless, so that we should no longer be slaves to sin.	16	OEB
Romans	6	7	For the man who has so died has been pronounced righteous and released from sin.	16	OEB
Romans	6	8	And our belief is, that, as we have shared Christ’s death, we will also share his life.	16	OEB
Romans	6	9	We know, indeed, that Christ, having once risen from the dead, will not die again. Death has power over him no longer.	16	OEB
Romans	6	10	For the death that he died was a death to sin, once and for all. But the life that he now lives, he lives for God.	16	OEB
Romans	6	11	So let it be with you – regard yourselves as dead to sin, but as living for God, through union with Christ Jesus.	16	OEB
Romans	6	12	Therefore do not let sin reign in your mortal bodies and compel you to obey its cravings.	16	OEB
Romans	6	13	Do not offer any part of your bodies to sin, in the cause of unrighteousness, but once for all offer yourselves to God (as those who, though once dead, now have life), and devote every part of your bodies to the cause of righteousness.	16	OEB
Romans	6	14	For sin will not lord it over you. You are living under the reign, not of Law, but of love.	16	OEB
Romans	6	15	What follows, then? Are we to sin because we are living under the reign of love and not of Law? Heaven forbid!	16	OEB
Romans	6	16	Surely you know that when you offer yourselves as servants, to obey anyone, you are the servants of the person whom you obey, whether the service be a service to sin which leads to death, or a service to duty which leads to righteousness.	16	OEB
Romans	6	17	God be thanked that, though you were once servants of sin, yet you learned to give hearty obedience to that form of doctrine under which you were placed.	16	OEB
Romans	6	18	Set free from the control of sin, you became servants to righteousness.	16	OEB
Romans	6	19	I can but speak as people do because of the weakness of your earthly nature. Once you offered every part of your bodies to the service of impurity, and of wickedness, which leads to further wickedness. Now, in the same way, offer them to the service of righteousness, which leads to holiness.	16	OEB
Romans	6	20	While you were still servants of sin, you were free as regards righteousness.	16	OEB
Romans	6	21	But what were the fruits that you reaped from those things of which you are now ashamed? For the end of such things is death.	16	OEB
Romans	6	22	But now that you have been set free from the control of sin, and have become servants to God, the fruit that you reap is an ever increasing holiness, and the end eternal life.	16	OEB
Romans	6	23	The wages of sin are death, but the gift of God is eternal life, through union with Christ Jesus, our Lord.	16	OEB
Romans	7	1	Surely, friends, you know (for I am speaking to people who know what Law means) that Law has power over a person only as long as they lives.	16	OEB
Romans	7	2	For example, by law a married woman is bound to her husband while he is living; but, if her husband dies, she is set free from the law that bound her to him.	16	OEB
Romans	7	3	If, then, during her husband’s lifetime, she unites herself to another man, she will be called an adulteress; but, if her husband dies, the law has no further hold on her, nor, if she unites herself to another man, is she an adulteress.	16	OEB
Romans	7	4	And so with you, my friends; as far as the Law was concerned, you underwent death in the crucified body of the Christ, so that you might be united to another, to him who was raised from the dead, in order that our lives might bear fruit for God.	16	OEB
Romans	7	5	When we were living merely earthly lives, our sinful passions, aroused by the Law, were active in every part of our bodies, with the result that our lives bore fruit for death.	16	OEB
Romans	7	6	But now we are set free from the Law, because we are dead to that which once kept us under restraint; and so we serve under new, spiritual conditions, and not under old, written regulations.	16	OEB
Romans	7	7	What are we to say, then? That Law and sin are the same thing? Heaven forbid! On the contrary, I should not have learned what sin is, had not it been for Law. If the Law did not say ‘You must not covet,’ I should not know what it is to covet.	16	OEB
Romans	7	8	But sin took advantage of the commandment to arouse in me every form of covetousness, for where there is no consciousness of Law sin shows no sign of life.	16	OEB
Romans	7	9	There was a time when I myself, unconscious of Law, was alive; but when the commandment was brought home to me, sin sprang into life, while I died!	16	OEB
Romans	7	10	The commandment that should have meant life I found to result in death!	16	OEB
Romans	7	11	Sin took advantage of the commandment to deceive me, and used it to bring about my death.	16	OEB
Romans	7	12	And so the Law is holy, and each commandment is also holy, and just, and good.	16	OEB
Romans	7	13	Did, then, a thing, which in itself was good, involve death in my case? Heaven forbid! It was sin that involved death; so that, by its use of what I regarded as good to bring about my death, its true nature might appear; and in this way the commandment showed how intensely sinful sin is.	16	OEB
Romans	7	14	We know that the Law is spiritual, but I am earthly – sold into slavery to sin.	16	OEB
Romans	7	15	I do not understand my own actions. For I am so far from habitually doing what I want to do, that I find myself doing the thing that I hate.	16	OEB
Romans	7	16	But when I do what I want not to do, I am admitting that the Law is right.	16	OEB
Romans	7	17	This being so, the action is no longer my own, but is done by the sin which is within me.	16	OEB
Romans	7	18	I know that there is nothing good in me – I mean in my earthly nature. For, although it is easy for me to want to do right, to act rightly is not easy.	16	OEB
Romans	7	19	I fail to do the good thing that I want to do, but the bad thing that I want not to do – that I habitually do.	16	OEB
Romans	7	20	But, when I do the thing that I want not to do, the action is no longer my own, but is done by the sin which is within me.	16	OEB
Romans	7	21	This, then, is the law that I find – when I want to do right, wrong presents itself!	16	OEB
Romans	7	22	At heart I delight in the Law of God;	16	OEB
Romans	7	23	but throughout my body I see a different law, one which is in conflict with the law accepted by my reason, and which endeavors to make me a prisoner to that law of sin which exists throughout my body.	16	OEB
Romans	7	24	Miserable man that I am! Who will deliver me from the body that is bringing me to this death?	16	OEB
Romans	7	25	Thank God, there is deliverance through Jesus Christ, our Lord! Well then, for myself, with my reason I serve the Law of God, but with my earthly nature the Law of sin.	16	OEB
Romans	8	1	There is, therefore, now no condemnation for those who are in union with Christ Jesus;	16	OEB
Romans	8	2	for through your union with Christ Jesus, the Law of the life-giving Spirit has set you free from the Law of sin and death.	16	OEB
Romans	8	3	What Law could not do, in so far as our earthly nature weakened its action, God did, by sending his own Son, with a nature resembling our sinful nature, to atone for sin. He condemned sin in that earthly nature,	16	OEB
Romans	8	4	so that the requirements of the Law might be satisfied in us who live now in obedience, not to our earthly nature, but to the Spirit.	16	OEB
Romans	8	5	They who follow their earthly nature are earthly-minded, while they who follow the Spirit are spiritually minded.	16	OEB
Romans	8	6	To be earthly-minded means death, to be spiritually minded means life and peace;	16	OEB
Romans	8	7	because to be earthly-minded is to be an enemy to God, for such a mind does not submit to the Law of God, nor indeed can it do so.	16	OEB
Romans	8	8	They who are earthly cannot please God.	16	OEB
Romans	8	9	You, however, are not earthly but spiritual, since the Spirit of God lives within you. Unless a person has the Spirit of Christ, they do not belong to Christ;	16	OEB
Romans	8	10	but, if Christ is within you, then, though the body is dead as a consequence of sin, the spirit is life as a consequence of righteousness.	16	OEB
Romans	8	11	And, if the Spirit of him who raised Jesus from the dead lives within you, he who raised Christ Jesus from the dead will give life even to your mortal bodies, through his Spirit living within you.	16	OEB
Romans	8	12	So then, friends, we owe nothing to our earthly nature, that we should live in obedience to it.	16	OEB
Romans	8	13	If you live in obedience to your earthly nature, you will inevitably die; but if, by the power of the Spirit, you put an end to the evil habits of the body, you will live.	16	OEB
Romans	8	14	All who are guided by the Spirit of God are children of God.	16	OEB
Romans	8	15	For you did not receive the spirit of a slave, to fill you once more with fear, but the spirit of a child by adoption, which leads us to cry ‘Abba, our Father.’	16	OEB
Romans	8	16	The Spirit himself unites with our spirits in bearing witness to our being God’s children,	16	OEB
Romans	8	17	and if children, then heirs – heirs of God, and joint heirs with Christ, since we share Christ’s sufferings in order that we may also share his glory.	16	OEB
Romans	8	18	I do not count the sufferings of our present life worthy of mention when compared with the glory that is to be revealed and bestowed on us.	16	OEB
Romans	8	19	All nature awaits with eager expectation the appearing of the sons of God.	16	OEB
Romans	8	20	For nature was made subject to imperfection – not by its own choice, but owing to him who made it so –	16	OEB
Romans	8	21	yet not without the hope that some day nature, also, will be set free from enslavement to decay, and will attain to the freedom which will mark the glory of the children of God.	16	OEB
Romans	8	22	We know, indeed, that all nature alike has been groaning in the pains of labor to this very hour.	16	OEB
Romans	8	23	And not nature only; but we ourselves also, though we have already a first gift of the Spirit – we ourselves are inwardly groaning, while we eagerly await our full adoption as sons – the redemption of our bodies.	16	OEB
Romans	8	24	By our hope we were saved. But the thing hoped for is no longer an object of hope when it is before our eyes; for who hopes for what is before his eyes?	16	OEB
Romans	8	25	But when we hope for what is not before our eyes, then we wait for it with patience.	16	OEB
Romans	8	26	So, also, the Spirit supports us in our weakness. We do not even know how to pray as we should; but the Spirit himself pleads for us in sighs that can find no utterance.	16	OEB
Romans	8	27	Yet he who searches all our hearts knows what the Spirit’s meaning is, because the pleadings of the Spirit for Christ’s people are in accordance with his will.	16	OEB
Romans	8	28	But we do know that God causes all things to work together for the good of those who love him – those who have received the call in accordance with his purpose.	16	OEB
Romans	8	29	For those whom God chose from the first he also destined from the first to be transformed into likeness to his Son, so that his Son might be the eldest among many brothers and sisters.	16	OEB
Romans	8	30	And those whom God destined for this he also called; and those whom he called he also pronounced righteous; and those whom he pronounced righteous he also brought to glory.	16	OEB
Romans	8	31	What are we to say, then, in the light of all this?	16	OEB
Romans	8	32	God did not withhold his own Son, but gave him up on behalf of us all; will he not, then, with him, freely give us all things?	16	OEB
Romans	8	33	Who will bring a charge against any of God’s people? He who pronounces them righteous is God!	16	OEB
Romans	8	34	Who is there to condemn them? He who died for us is Christ Jesus! – or, rather, it was he who was raised from the dead, and who is now at God’s right hand and is even pleading on our behalf!	16	OEB
Romans	8	35	Who is there to separate us from the love of the Christ? Will trouble, or difficulty, or persecution, or hunger, or nakedness, or danger, or the sword?	16	OEB
Romans	8	36	Scripture says – ‘For your sake we are being killed all the day long, We are regarded as sheep to be slaughtered.’	16	OEB
Romans	8	37	Yet amid all these things we more than conquer through him who loved us!	16	OEB
Romans	8	38	For I am persuaded that neither death, nor life, nor angels, nor archangels, nor the present, nor the future, nor any powers,	16	OEB
Romans	8	39	nor height, nor depth, nor any other created thing, will be able to separate us from the love of God revealed in Christ Jesus, our Lord!	16	OEB
Romans	9	1	I am speaking the truth as one in union with Christ; it is no lie; and my conscience, enlightened by the Holy Spirit,	16	OEB
Romans	9	2	bears me out when I say that there is a great weight of sorrow on me and that my heart is never free from pain.	16	OEB
Romans	9	3	I could wish that I were myself accursed and severed from the Christ, for the sake of my people – my own flesh and blood.	16	OEB
Romans	9	4	For they are Israelites, and theirs are the adoption as children, the visible presence, the covenants, the revealed Law, the Temple worship, and the promises.	16	OEB
Romans	9	5	They are descended from the patriarchs, and, as far as his human nature was concerned, from them came the Christ – he who is supreme over all things, God for ever blessed. Amen.	16	OEB
Romans	9	6	Not that God’s Word has failed. For it is not all who are descended from Israel who are true Israelites;	16	OEB
Romans	9	7	nor, because they are Abraham’s descendants, are they all his children; but – ‘It is Isaac’s children who will be called your descendants.’	16	OEB
Romans	9	8	This means that it is not the children born in the course of nature who are God’s children, but it is the children born in fulfillment of the promise who are to be regarded as Abraham’s descendants.	16	OEB
Romans	9	9	For these words are the words of a promise – ‘About this time I will come, and Sarah will have a son.’	16	OEB
Romans	9	10	Nor is that all. There is also the case of Rebecca, when she was about to bear children to our ancestor Isaac.	16	OEB
Romans	9	11	For in order that the purpose of God, working through selection, might not fail – a selection depending, not on obedience, but on his call – Rebecca was told, before her children were born and before they had done anything either right or wrong,	16	OEB
Romans	9	12	that the elder would be a servant to the younger.	16	OEB
Romans	9	13	The words of scripture are – ‘I loved Jacob, but I hated Esau.’	16	OEB
Romans	9	14	What are we to say, then? Is God guilty of injustice? Heaven forbid!	16	OEB
Romans	9	15	For his words to Moses are – ‘I will take pity on whom I take pity, and be merciful to whom I am merciful.’	16	OEB
Romans	9	16	So, then, all depends, not on human wishes or human efforts, but on God’s mercy.	16	OEB
